title,author,score,num_comments,url,created_utc,subreddit
Sunday Daily Thread: What's everyone working on this week?,AutoModerator,2,3,https://www.reddit.com/r/Python/comments/1rtz4pi/sunday_daily_thread_whats_everyone_working_on/,2026-03-15 00:00:16,Python
Tuesday Daily Thread: Advanced questions,AutoModerator,2,0,https://www.reddit.com/r/Python/comments/1rvqus3/tuesday_daily_thread_advanced_questions/,2026-03-17 00:00:15,Python
"Kenneth Reitz says ""open source gave me everything until I had nothing left to give""",Capital-Interview-23,276,36,https://www.reddit.com/r/Python/comments/1rwxeqo/kenneth_reitz_says_open_source_gave_me_everything/,2026-03-18 07:39:55,Python
Mods have a couple of months to stop AI slop project spam before this sub is dead,Fun-Employee9309,831,177,https://www.reddit.com/r/Python/comments/1rwoq79/mods_have_a_couple_of_months_to_stop_ai_slop/,2026-03-18 00:27:03,Python
PyCon US 2026: Typing Summit,BeamMeUpBiscotti,11,0,https://www.reddit.com/r/Python/comments/1rx2nkv/pycon_us_2026_typing_summit/,2026-03-18 12:34:33,Python
Exploring a typed approach to pipelines in Python - built a small framework (ICO),Sergio_Shu,3,3,https://www.reddit.com/r/Python/comments/1rxazwp/exploring_a_typed_approach_to_pipelines_in_python/,2026-03-18 17:53:37,Python
[P] Fast Simplex: 2D/3D interpolation 20-100x faster than Delaunay with simpler algorithm,wexionar,1,0,https://www.reddit.com/r/Python/comments/1rxekp5/p_fast_simplex_2d3d_interpolation_20100x_faster/,2026-03-18 20:02:14,Python
"I made a fast PDF to PNG library, feedback welcome",Civil-Image5411,0,7,https://www.reddit.com/r/Python/comments/1rxaui1/i_made_a_fast_pdf_to_png_library_feedback_welcome/,2026-03-18 17:48:27,Python
High-volume SonyFlake ID generation,zipfile_d,1,1,https://www.reddit.com/r/Python/comments/1rx9lhb/highvolume_sonyflake_id_generation/,2026-03-18 17:04:06,Python
"Open-source computer-use agent: provider-agnostic, cross-platform, 75% OSWorld (&gt; human)",IlyaZelen,0,0,https://www.reddit.com/r/Python/comments/1rxecj0/opensource_computeruse_agent_provideragnostic/,2026-03-18 19:54:12,Python
"PDFstract: extract, chunk, and embed PDFs in one command (CLI + Python)",GritSar,0,0,https://www.reddit.com/r/Python/comments/1rxd7y5/pdfstract_extract_chunk_and_embed_pdfs_in_one/,2026-03-18 19:13:34,Python
StateWeave: open-source library to move AI agent state across 10 frameworks,baycyclist,0,4,https://www.reddit.com/r/Python/comments/1rxcw69/stateweave_opensource_library_to_move_ai_agent/,2026-03-18 19:01:58,Python
Using the walrus operator := to self-document if conditions,dotXem,55,101,https://www.reddit.com/r/Python/comments/1rw18i5/using_the_walrus_operator_to_selfdocument_if/,2026-03-17 08:55:22,Python
Started new projects without FastAPI,scotsmanintoon,0,8,https://www.reddit.com/r/Python/comments/1rx5fgz/started_new_projects_without_fastapi/,2026-03-18 14:28:49,Python
"Open-source Python interview prep - 424 questions across 28 topics, all with runnable code",prakersh,0,5,https://www.reddit.com/r/Python/comments/1rx20dz/opensource_python_interview_prep_424_questions/,2026-03-18 12:04:06,Python
Built a platform to find dev teammates + live code together (now fully in English),Heavy_Association633,0,0,https://www.reddit.com/r/Python/comments/1rx1fs7/built_a_platform_to_find_dev_teammates_live_code/,2026-03-18 11:35:54,Python
"Flask email classifier powered by LLMs — dashboard UI, 182 tests, no frontend build step",Powerful-Island-526,0,1,https://www.reddit.com/r/Python/comments/1rx18dj/flask_email_classifier_powered_by_llms_dashboard/,2026-03-18 11:25:27,Python
i built a Python library that tells you who said what in any audio file,Gr1zzly8ear,94,30,https://www.reddit.com/r/Python/comments/1rvoxl3/i_built_a_python_library_that_tells_you_who_said/,2026-03-16 22:45:07,Python
Is it a sensible move?,Trick-Loss-4981,0,2,https://www.reddit.com/r/Python/comments/1rwygat/is_it_a_sensible_move/,2026-03-18 08:46:35,Python
Phyton programmieren,Icy_Protection7989,0,5,https://www.reddit.com/r/Python/comments/1rx48eq/phyton_programmieren/,2026-03-18 13:42:11,Python
Free Spotify Ad Muter,AcrobaticLunch9737,0,2,https://www.reddit.com/r/Python/comments/1rwzqoy/free_spotify_ad_muter/,2026-03-18 10:05:22,Python
conjecscore.org (alpha version) - A scoreboard for open problems.,cs61bredditaccount,0,2,https://www.reddit.com/r/Python/comments/1rwrfff/conjecscoreorg_alpha_version_a_scoreboard_for/,2026-03-18 02:24:17,Python
Comparing Python Type Checkers: Typing Spec Conformance,BeamMeUpBiscotti,114,27,https://www.reddit.com/r/Python/comments/1rv80tj/comparing_python_type_checkers_typing_spec/,2026-03-16 12:26:49,Python
We let type hints completely ruin the readability of python..,Firemage1213,0,26,https://www.reddit.com/r/Python/comments/1rwwjug/we_let_type_hints_completely_ruin_the_readability/,2026-03-18 06:46:38,Python
albums: interactive tool to manage a music library (with video intro),s71n6r4y,0,5,https://www.reddit.com/r/Python/comments/1rwm19s/albums_interactive_tool_to_manage_a_music_library/,2026-03-17 22:42:49,Python
My First Port Scanner with multithreading and banner grabbing and I want improving it,veysel_yilmaz37,0,15,https://www.reddit.com/r/Python/comments/1rwjuhc/my_first_port_scanner_with_multithreading_and/,2026-03-17 21:21:15,Python
"pip install runcycles — hard budget limits for AI agent calls, enforced before they run",jkoolcloud,0,3,https://www.reddit.com/r/Python/comments/1rwh4vr/pip_install_runcycles_hard_budget_limits_for_ai/,2026-03-17 19:44:43,Python
nobody asked but I organized national FBI crime data into a searchable site (My first real website),Empty-Individual4835,10,1,https://www.reddit.com/r/Python/comments/1rve8k1/nobody_asked_but_i_organized_national_fbi_crime/,2026-03-16 16:26:35,Python
built an open-source CLI that scans Python AI projects for EU AI Act compliance — benchmarked it ag,Last-Spring-1773,0,5,https://www.reddit.com/r/Python/comments/1rwb879/built_an_opensource_cli_that_scans_python_ai/,2026-03-17 16:21:17,Python
"I built FileForge — a professional file organizer with auto-classification, SHA-256 duplicate detect",Prestigious_Pipe9587,0,19,https://www.reddit.com/r/Python/comments/1rwffus/i_built_fileforge_a_professional_file_organizer/,2026-03-17 18:46:08,Python
I just added a built-in Real-Time Cloud IDE synced with GitHub,Heavy_Association633,0,0,https://www.reddit.com/r/Python/comments/1rw312s/i_just_added_a_builtin_realtime_cloud_ide_synced/,2026-03-17 10:43:21,Python
Marketing Pipeline in Python Using Claude Code (repo and forkable example),MathematicianBig2071,0,3,https://www.reddit.com/r/Python/comments/1rw7vay/marketing_pipeline_in_python_using_claude_code/,2026-03-17 14:20:28,Python
"A quick review of `tyro`, a CLI library.",HommeMusical,12,27,https://www.reddit.com/r/Python/comments/1rv7agv/a_quick_review_of_tyro_a_cli_library/,2026-03-16 11:51:26,Python
Image region of interest tracker in Python3 using OpenCV,w3mk,5,0,https://www.reddit.com/r/Python/comments/1rvg7iy/image_region_of_interest_tracker_in_python3_using/,2026-03-16 17:34:22,Python
"tryke: A fast, modern test framework for Python",Crafty-Visual198,0,3,https://www.reddit.com/r/Python/comments/1rw5ujy/tryke_a_fast_modern_test_framework_for_python/,2026-03-17 13:00:16,Python
"I built a one‑line, local‑first debugger for ai agents – finally, no more log spelunking",sudo_jod,0,0,https://www.reddit.com/r/Python/comments/1rw7bk2/i_built_a_oneline_localfirst_debugger_for_ai/,2026-03-17 13:59:46,Python
`acs-nativity`: A Python package for analyzing U.S. immigration trends,Fresh-Orange-8811,0,0,https://www.reddit.com/r/Python/comments/1rvqbtk/acsnativity_a_python_package_for_analyzing_us/,2026-03-16 23:38:17,Python
"Python devs, you are on demand!",AdForsaken7506,0,15,https://www.reddit.com/r/Python/comments/1rw76f8/python_devs_you_are_on_demand/,2026-03-17 13:54:08,Python
"ClipForge: AI-powered short-form video generator in Python (~2K lines, MIT)",DarkPancakes_,0,9,https://www.reddit.com/r/Python/comments/1rw1nb4/clipforge_aipowered_shortform_video_generator_in/,2026-03-17 09:21:22,Python
Featurevisor: Git based feature flag and remote config management tool with Python SDK (open source),fahad19,2,1,https://www.reddit.com/r/Python/comments/1rvkvdd/featurevisor_git_based_feature_flag_and_remote/,2026-03-16 20:16:39,Python
Library to integrate Logbook with Rich and Journald,bachkhois,6,1,https://www.reddit.com/r/Python/comments/1rv6q4l/library_to_integrate_logbook_with_rich_and/,2026-03-16 11:21:43,Python
[Project] NetGlance - A macOS-inspired network monitor for the Windows Taskbar (PyQt6 + NumPy),Status_Ad_8693,2,2,https://www.reddit.com/r/Python/comments/1rvd76d/project_netglance_a_macosinspired_network_monitor/,2026-03-16 15:50:14,Python
Myelin Kernel: a lightweight reinforcement-based memory kernel for Python AI agents (open source),BackgroundBalance502,1,4,https://www.reddit.com/r/Python/comments/1rvh67l/myelin_kernel_a_lightweight_reinforcementbased/,2026-03-16 18:07:29,Python
"Showcase: kokage-ui — build FastAPI UIs in pure Python (no JS, no templates, no build step)",neka-nat,3,4,https://www.reddit.com/r/Python/comments/1rv7lcs/showcase_kokageui_build_fastapi_uis_in_pure/,2026-03-16 12:06:02,Python
slamd - a dead simple 3D visualizer for Python,mega_monkey_mind,73,10,https://www.reddit.com/r/Python/comments/1rukp2j/slamd_a_dead_simple_3d_visualizer_for_python/,2026-03-15 17:52:41,Python
Building a Reliable AI Streaming API using FastAPI + Redis Streams,Supisuse-Tiger-399,0,2,https://www.reddit.com/r/Python/comments/1rvwetx/building_a_reliable_ai_streaming_api_using/,2026-03-17 04:08:42,Python
tethered - Runtime network egress control for Python in one function call,shcherbaksergii,0,0,https://www.reddit.com/r/Python/comments/1rvdqdz/tethered_runtime_network_egress_control_for/,2026-03-16 16:08:56,Python
Pymetrica: a new quality analysis tool,Effective-Total-2312,34,19,https://www.reddit.com/r/Python/comments/1rupci4/pymetrica_a_new_quality_analysis_tool/,2026-03-15 20:48:48,Python
ARC - Automatic Recovery Controller for PyTorch training failures,winter_2209,1,8,https://www.reddit.com/r/Python/comments/1rvct0q/arc_automatic_recovery_controller_for_pytorch/,2026-03-16 15:35:52,Python
"Used FastF1, FastAPI, and LightGBM to build an F1 race strategy simulator",CharacterAd4557,10,1,https://www.reddit.com/r/Python/comments/1ruxquu/used_fastf1_fastapi_and_lightgbm_to_build_an_f1/,2026-03-16 02:45:33,Python
Developers pain points,ahsansheraz,0,30,https://www.reddit.com/r/Python/comments/1rvx52k/developers_pain_points/,2026-03-17 04:46:44,Python
Robyn (finally) offers first party Pydantic integration 🎉,stealthanthrax,60,5,https://www.reddit.com/r/Python/comments/1rufc3o/robyn_finally_offers_first_party_pydantic/,2026-03-15 14:23:41,Python
"I'm building a terminal chat app on top of my own TCP library, would you use it?",Striking_Sandwich_80,0,10,https://www.reddit.com/r/Python/comments/1rvpwnb/im_building_a_terminal_chat_app_on_top_of_my_own/,2026-03-16 23:21:47,Python
I used C++ and nanobind to build a zero-copy graph engine that lets Python train on 50GB datasets,Important-Trash-4868,116,37,https://www.reddit.com/r/Python/comments/1ru9qz9/i_used_c_and_nanobind_to_build_a_zerocopy_graph/,2026-03-15 09:31:58,Python
[Showcase] pytest-gremlins v1.5.0: Fast mutation testing as a pytest plugin.,Aromatic_Pumpkin8856,7,2,https://www.reddit.com/r/Python/comments/1ruv4wx/showcase_pytestgremlins_v150_fast_mutation/,2026-03-16 00:46:28,Python
Monday Daily Thread: Project ideas!,AutoModerator,8,4,https://www.reddit.com/r/Python/comments/1ruu3rw/monday_daily_thread_project_ideas/,2026-03-16 00:00:25,Python
Little game I'm working on: BSCP,Jarjarbin_YT,1,0,https://www.reddit.com/r/Python/comments/1rv672u/little_game_im_working_on_bscp/,2026-03-16 10:52:31,Python
Scripting in API tools using Python (showcase),GuaranteePotential90,1,0,https://www.reddit.com/r/Python/comments/1rv5sl0/scripting_in_api_tools_using_python_showcase/,2026-03-16 10:29:15,Python
song-download-api-when-spotify-metadata is present,Possible-Internet188,0,1,https://www.reddit.com/r/Python/comments/1rv5jnm/songdownloadapiwhenspotifymetadata_is_present/,2026-03-16 10:14:33,Python
I wrote a Matplotlib scale that collapses weekends and off-hours on datetime x-axis,saemeon,22,0,https://www.reddit.com/r/Python/comments/1rujgqz/i_wrote_a_matplotlib_scale_that_collapses/,2026-03-15 17:05:40,Python
"justx - An interactive command library for your terminal, powered by just",fpgmaas,37,12,https://www.reddit.com/r/Python/comments/1ruemue/justx_an_interactive_command_library_for_your/,2026-03-15 13:54:18,Python
printo: Auto-generate __repr__ from __init__ with zero boilerplate,pomponchik,0,11,https://www.reddit.com/r/Python/comments/1rvipw2/printo_autogenerate_repr_from_init_with_zero/,2026-03-16 19:01:34,Python
"PackageFix — paste your requirements.txt, get a fixed manifest back. Live CVE scan via OSV + CISA KE",Human_Mode6633,0,0,https://www.reddit.com/r/Python/comments/1rvb23k/packagefix_paste_your_requirementstxt_get_a_fixed/,2026-03-16 14:31:15,Python
Best Python approach for extracting structured financial data from inconsistent PDFs?,leggo-my-eggo-1,44,24,https://www.reddit.com/r/Python/comments/1ru90rt/best_python_approach_for_extracting_structured/,2026-03-15 08:46:37,Python
Mesa 4.0 alpha released,Balance-,22,6,https://www.reddit.com/r/Python/comments/1ruc3q9/mesa_40_alpha_released/,2026-03-15 11:52:00,Python
Update: We’re adding real-time collaborative coding to our open dev platform,Heavy_Association633,0,0,https://www.reddit.com/r/Python/comments/1rv7ocn/update_were_adding_realtime_collaborative_coding/,2026-03-16 12:10:10,Python
Asyncio Port Scanner in Python (CSV/JSON reports),Swimming_Lab_9414,1,0,https://www.reddit.com/r/Python/comments/1ruwl1a/asyncio_port_scanner_in_python_csvjson_reports/,2026-03-16 01:51:30,Python
roche-sandbox: context manager for running untrusted code in sandbox with secure defaults,leland_fy,0,2,https://www.reddit.com/r/Python/comments/1ruzt2x/rochesandbox_context_manager_for_running/,2026-03-16 04:27:50,Python
I built a simple online compiler for my students to practice coding,No_Election_879,0,10,https://www.reddit.com/r/Python/comments/1rv31yr/i_built_a_simple_online_compiler_for_my_students/,2026-03-16 07:38:59,Python
I made a Python tool to detect performance regressions - Oracletrace,KaykCaputo,0,0,https://www.reddit.com/r/Python/comments/1rupjar/i_made_a_python_tool_to_detect_performance/,2026-03-15 20:55:55,Python
Unrooted tree for multidimentional projection of data in XY space,sixtofourD,1,2,https://www.reddit.com/r/Python/comments/1rum88e/unrooted_tree_for_multidimentional_projection_of/,2026-03-15 18:50:33,Python
Intermediate in Python and want to build mobile applications,theNotoriousJew,0,16,https://www.reddit.com/r/Python/comments/1ruu0zh/intermediate_in_python_and_want_to_build_mobile/,2026-03-15 23:57:13,Python
I built an open-source Python tool for semantic code search + AI agent tooling (2.5k downloads so fa,Ambitious-Credit-722,0,3,https://www.reddit.com/r/Python/comments/1ruy56p/i_built_an_opensource_python_tool_for_semantic/,2026-03-16 03:04:18,Python
Built a CLI tool that runs pre-training checks on PyTorch pipelines — pip install preflight-ml,Red_Egnival,1,0,https://www.reddit.com/r/Python/comments/1rui1dq/built_a_cli_tool_that_runs_pretraining_checks_on/,2026-03-15 16:10:22,Python
What projects to do alone.,Flying_Puck29,1,21,https://www.reddit.com/r/Python/comments/1ru90kz/what_projects_to_do_alone/,2026-03-15 08:46:19,Python
Making an app run in the background,Pure_Turn_7245,0,8,https://www.reddit.com/r/Python/comments/1ruq8hj/making_an_app_run_in_the_background/,2026-03-15 21:22:36,Python
GoPdfSuit v5.0.0: A high-performance PDF engine for Python (now on PyPI),chinmay06,33,13,https://www.reddit.com/r/Python/comments/1rtjryf/gopdfsuit_v500_a_highperformance_pdf_engine_for/,2026-03-14 13:43:16,Python
"**I made a ""Folding@home"" swarm for local LLM research**",M4s4,0,4,https://www.reddit.com/r/Python/comments/1ruihdp/i_made_a_foldinghome_swarm_for_local_llm_research/,2026-03-15 16:27:58,Python
termboard — a local Kanban board that lives entirely in your terminal and a single JSON file,WonderfulMain5602,14,4,https://www.reddit.com/r/Python/comments/1rtmdjs/termboard_a_local_kanban_board_that_lives/,2026-03-14 15:31:36,Python
I open-sourced JobMatch Bot – a Python pipeline for ATS job aggregation and resume-aware ranking,Itchy_Cut1802,1,1,https://www.reddit.com/r/Python/comments/1ru4xv4/i_opensourced_jobmatch_bot_a_python_pipeline_for/,2026-03-15 04:41:20,Python
Scraping Amazon Product Data With Python Without Getting Blocked,Bartrader,0,3,https://www.reddit.com/r/Python/comments/1ruek51/scraping_amazon_product_data_with_python_without/,2026-03-15 13:51:08,Python
Pywho - Python Environment Interceptor,ahsansheraz,0,9,https://www.reddit.com/r/Python/comments/1ruppfh/pywho_python_environment_interceptor/,2026-03-15 21:02:14,Python
italian-tax-validators: Italian Codice Fiscale &amp; Partita IVA validation for Python — zero deps,Complete_Tough4505,22,2,https://www.reddit.com/r/Python/comments/1rtg65w/italiantaxvalidators_italian_codice_fiscale/,2026-03-14 10:39:44,Python
I made @karpathy's Autoresearch work on CPU - and it's NOT bloated,M4s4,0,8,https://www.reddit.com/r/Python/comments/1rua9yr/i_made_karpathys_autoresearch_work_on_cpu_and_its/,2026-03-15 10:05:10,Python
slixmpp 1.14 released,Neustradamus,3,1,https://www.reddit.com/r/Python/comments/1rtqp1f/slixmpp_114_released/,2026-03-14 18:19:59,Python
Application layer security for FastAPI and Flask,PA100T0,58,30,https://www.reddit.com/r/Python/comments/1rt20n2/application_layer_security_for_fastapi_and_flask/,2026-03-13 22:34:21,Python
"PyTogether, the 'Google Docs' for Python (free and open-source, real-time browser IDE)",Pokiet,116,17,https://www.reddit.com/r/Python/comments/1rsrz0x/pytogether_the_google_docs_for_python_free_and/,2026-03-13 16:25:09,Python
Virtual environment setup,Broad-Journalist4262,0,26,https://www.reddit.com/r/Python/comments/1ru3mbr/virtual_environment_setup/,2026-03-15 03:32:56,Python
I built a platform to find developers to collaborate on projects — looking for feedback,Heavy_Association633,2,20,https://www.reddit.com/r/Python/comments/1rthmzx/i_built_a_platform_to_find_developers_to/,2026-03-14 12:01:45,Python
Stop using range(len()) in your Python loops enumerate() exists and it is cleaner,More-Station-6365,0,16,https://www.reddit.com/r/Python/comments/1ru5k44/stop_using_rangelen_in_your_python_loops/,2026-03-15 05:14:51,Python
What small Python scripts or tools have made your daily workflow easier?,chop_chop_13,142,86,https://www.reddit.com/r/Python/comments/1rsi88l/what_small_python_scripts_or_tools_have_made_your/,2026-03-13 09:01:13,Python
Suggestions for My Notes App Project,Ok_Kaleidoscope_4098,0,19,https://www.reddit.com/r/Python/comments/1rtnfi4/suggestions_for_my_notes_app_project/,2026-03-14 16:13:35,Python
Python Tackles Erdős #452 Step-Resonance CRT Constructions,zero_moo-s,0,0,https://www.reddit.com/r/Python/comments/1rtnor2/python_tackles_erdős_452_stepresonance_crt/,2026-03-14 16:23:48,Python
A simple auto-PPPOE python script!,Livid_Rock_6441,3,1,https://www.reddit.com/r/Python/comments/1rt5vbd/a_simple_autopppoe_python_script/,2026-03-14 01:14:13,Python
"I built crawldiff – ""git log"" for any website. Track changes with diffs and AI summaries.",annoyed_archipelago,1,4,https://www.reddit.com/r/Python/comments/1rtcnw2/i_built_crawldiff_git_log_for_any_website_track/,2026-03-14 07:02:14,Python
Is the new MacBook Neo ok for python network testing?,Codeeveryday123,0,9,https://www.reddit.com/r/Python/comments/1rtqud0/is_the_new_macbook_neo_ok_for_python_network/,2026-03-14 18:25:53,Python
Saturday Daily Thread: Resource Request and Sharing! Daily Thread,AutoModerator,2,0,https://www.reddit.com/r/Python/comments/1rt453t/saturday_daily_thread_resource_request_and/,2026-03-14 00:00:29,Python
What hidden gem Python modules do you use and why?,zenos1337,396,183,https://www.reddit.com/r/Python/comments/1rrz3kx/what_hidden_gem_python_modules_do_you_use_and_why/,2026-03-12 18:37:05,Python
I ended building an oversimplfied durable workflow engine after overcomplicating my data pipelines,powerlifter86,14,19,https://www.reddit.com/r/Python/comments/1rsl8nj/i_ended_building_an_oversimplfied_durable/,2026-03-13 11:53:36,Python
Productivity tools for lazy computer dwellers,Environmental-Card62,0,0,https://www.reddit.com/r/Python/comments/1rtcxk8/productivity_tools_for_lazy_computer_dwellers/,2026-03-14 07:17:47,Python
"Weekly Entering &amp; Transitioning - Thread 16 Mar, 2026 - 23 Mar, 2026",AutoModerator,8,10,https://www.reddit.com/r/datascience/comments/1ruzapt/weekly_entering_transitioning_thread_16_mar_2026/,2026-03-16 04:01:23,datascience
Bombed a Data Scientist Interview!,tits_mcgee_92,6,14,https://www.reddit.com/r/datascience/comments/1rxf49a/bombed_a_data_scientist_interview/,2026-03-18 20:21:21,datascience
Dealing with GenAI Overuse,DubGrips,69,39,https://www.reddit.com/r/datascience/comments/1rwppwz/dealing_with_genai_overuse/,2026-03-18 01:09:01,datascience
Nobody talks about the career trap that's about to get a lot more dangerous for analysts,Clicketrie,20,41,/r/mavenanalytics/comments/1rwcknm/nobody_talks_about_the_career_trap_thats_about_to/,2026-03-17 17:09:42,datascience
Switching out of Data Strategy to Technical work,alchemicalchemist,13,9,https://www.reddit.com/r/datascience/comments/1rwccxs/switching_out_of_data_strategy_to_technical_work/,2026-03-17 17:01:02,datascience
"Is working as a data scientist (ML focus) but not getting to interact with the business a common tradeoff, or is my company just weird?",TaterTot0809,39,19,https://www.reddit.com/r/datascience/comments/1rv8tmo/is_working_as_a_data_scientist_ml_focus_but_not/,2026-03-16 13:02:46,datascience
Joining Meta in June... what should be my game plan?,saagggssss,39,46,https://www.reddit.com/r/datascience/comments/1rtypmu/joining_meta_in_june_what_should_be_my_game_plan/,2026-03-14 23:42:22,datascience
Easiest Python question got me rejected from FAANG,ds_contractor,273,176,https://www.reddit.com/r/datascience/comments/1rsrm2s/easiest_python_question_got_me_rejected_from_faang/,2026-03-13 16:12:10,datascience
8 failed interviews so far. When do you stop and reassess vs just keep playing the numbers game?,quite--average,74,38,https://www.reddit.com/r/datascience/comments/1rsr49o/8_failed_interviews_so_far_when_do_you_stop_and/,2026-03-13 15:54:11,datascience
How to take the next step?,Mountain_Pass566,30,32,https://www.reddit.com/r/datascience/comments/1rsdlu2/how_to_take_the_next_step/,2026-03-13 04:26:23,datascience
Network Science,Kati1998,25,23,https://www.reddit.com/r/datascience/comments/1rs5siy/network_science/,2026-03-12 22:42:09,datascience
Real World Data Project,DelayedPot,13,20,https://www.reddit.com/r/datascience/comments/1rs1xj4/real_world_data_project/,2026-03-12 20:18:58,datascience
Is 32-64 Gb ram for data science the new standard now?,Tarneks,36,58,https://www.reddit.com/r/datascience/comments/1rrn7l6/is_3264_gb_ram_for_data_science_the_new_standard/,2026-03-12 10:36:26,datascience
What is the split between focus on Generative AI and Predictive AI at your company?,AnonForSure,24,48,https://www.reddit.com/r/datascience/comments/1rrouk2/what_is_the_split_between_focus_on_generative_ai/,2026-03-12 12:01:55,datascience
hiring freeze at meta,No-Mud4063,122,70,https://www.reddit.com/r/datascience/comments/1rra0go/hiring_freeze_at_meta/,2026-03-11 23:18:35,datascience
Advice on modeling pipeline and modeling methodology,dockerlemon,58,55,https://www.reddit.com/r/datascience/comments/1rq1lhk/advice_on_modeling_pipeline_and_modeling/,2026-03-10 16:27:41,datascience
Error when generating predicted probabilities for lasso logistic regression,RobertWF_47,13,11,https://www.reddit.com/r/datascience/comments/1rqajlo/error_when_generating_predicted_probabilities_for/,2026-03-10 21:44:43,datascience
"I've just open-sourced MessyData, a synthetic dirty data generator. It lets you programmatically generate data with anomalies and data quality issues.",santiviquez,125,18,https://www.reddit.com/r/datascience/comments/1rp7ku6/ive_just_opensourced_messydata_a_synthetic_dirty/,2026-03-09 18:01:19,datascience
"CompTIA: Tech Employment Increased by 60,000 Last Month, and the Hiring Signals Are Interesting",CryoSchema,66,12,https://www.interviewquery.com/p/tech-hiring-trends-comptia-2026,2026-03-09 16:56:46,datascience
Learning Resources/Bootcamps for MLE,_hairyberry_,35,14,https://www.reddit.com/r/datascience/comments/1rpau4r/learning_resourcesbootcamps_for_mle/,2026-03-09 19:57:28,datascience
"Weekly Entering &amp; Transitioning - Thread 09 Mar, 2026 - 16 Mar, 2026",AutoModerator,14,12,https://www.reddit.com/r/datascience/comments/1roq1r5/weekly_entering_transitioning_thread_09_mar_2026/,2026-03-09 04:01:27,datascience
How do you deal with bad bosses?,AdministrativeRub484,59,54,https://www.reddit.com/r/datascience/comments/1rmhla2/how_do_you_deal_with_bad_bosses/,2026-03-06 15:50:10,datascience
How to prep for Full Stack DS interview?,LeaguePrototype,36,25,https://www.reddit.com/r/datascience/comments/1rm0map/how_to_prep_for_full_stack_ds_interview/,2026-03-06 01:43:12,datascience
New ML/DS project structure for human &amp; AI,SummerElectrical3642,3,10,https://www.reddit.com/r/datascience/comments/1rmfkug/new_mlds_project_structure_for_human_ai/,2026-03-06 14:33:21,datascience
Mar 2026 : How effective is a Copilot Studio RAG Agent for easy/medium use-cases?,noimgonnalie,11,7,/r/copilotstudio/comments/1rm7nlh/mar_2026_how_effective_is_a_copilot_studio_rag/,2026-03-06 07:53:17,datascience
