title,author,score,num_comments,url,created_utc,subreddit
"I web scraped 72,728 courses from the catalogs of 7 Universities",digital__navigator,55,14,https://www.reddit.com/r/webscraping/comments/1r8s88p/i_web_scraped_72728_courses_from_the_catalogs_of/,2026-02-19 06:50:55,webscraping
actually get their decklists? (noob here),Dariospinett,1,2,https://www.reddit.com/r/webscraping/comments/1r916mw/actually_get_their_decklists_noob_here/,2026-02-19 14:50:57,webscraping
Web scraping difficulty in obtaining full list of a website,Dramatic-Bill4714,0,5,https://www.reddit.com/r/webscraping/comments/1r9005k/web_scraping_difficulty_in_obtaining_full_list_of/,2026-02-19 14:02:20,webscraping
Reverse engineering the new Datadome VM 🔥,xkiiann,37,5,https://github.com/xKiian/datadome-vm,2026-02-17 17:34:44,webscraping
Steam Partner API Issues,randomstate42,0,1,https://www.reddit.com/r/webscraping/comments/1r81f84/steam_partner_api_issues/,2026-02-18 12:16:03,webscraping
WebMCP is insane....,GeobotPY,26,5,https://v.redd.it/gzt3djhw73kg1,2026-02-17 17:11:54,webscraping
How do i deal with cloudflare turnstile anti-bot using curl cffi?,letopeto,10,8,https://www.reddit.com/r/webscraping/comments/1r7i5gt/how_do_i_deal_with_cloudflare_turnstile_antibot/,2026-02-17 20:43:46,webscraping
how do you decide when something truly requires proxies?,Free-Path-5550,11,16,https://www.reddit.com/r/webscraping/comments/1r7gbwk/how_do_you_decide_when_something_truly_requires/,2026-02-17 19:38:16,webscraping
Which tracker/dashboard tools do you guys use to monitor processes?,Silver-Tune-2792,6,6,https://www.reddit.com/r/webscraping/comments/1r7gsr9/which_trackerdashboard_tools_do_you_guys_use_to/,2026-02-17 19:54:58,webscraping
"Weekly Webscrapers - Hiring, FAQs, etc",AutoModerator,10,10,https://www.reddit.com/r/webscraping/comments/1r75el6/weekly_webscrapers_hiring_faqs_etc/,2026-02-17 13:02:04,webscraping
March 2026 - Monthly thread | Career questions on how to start and AI related questions go here,emsemele,2,8,https://www.reddit.com/r/dataanalyst/comments/1rhvx77/march_2026_monthly_thread_career_questions_on_how/,2026-03-01 12:19:27,dataanalyst
Anyone interviewed for Data Analyst at Windfall? What was the process like?,ZookeepergameSea5379,5,1,https://www.reddit.com/r/dataanalyst/comments/1rwk3l5/anyone_interviewed_for_data_analyst_at_windfall/,2026-03-17 21:30:37,dataanalyst
Data analyst / Business analysts - Any real time analsyt - Suggestions please?,roam_and_scream,7,4,https://www.reddit.com/r/dataanalyst/comments/1rwfg8a/data_analyst_business_analysts_any_real_time/,2026-03-17 18:46:30,dataanalyst
Give Suggestions for a laptop for Data Analysis,Small_Story_2107,1,0,https://www.reddit.com/r/dataanalyst/comments/1rwqpeg/give_suggestions_for_a_laptop_for_data_analysis/,2026-03-18 01:52:07,dataanalyst
Just finished the Google Data Analytics Cert. Best place for beginner/intermediate projects?,Mr__Mani,20,7,https://www.reddit.com/r/dataanalyst/comments/1rvjtll/just_finished_the_google_data_analytics_cert_best/,2026-03-16 19:39:37,dataanalyst
"Asked for a promotion, got ""no budget"" and a surprise bad review. Red flag?",No_Minimum_6523,6,1,https://www.reddit.com/r/dataanalyst/comments/1rvk9tg/asked_for_a_promotion_got_no_budget_and_a/,2026-03-16 19:55:26,dataanalyst
Where can I practice Interview Sql questions and actual work like quarries,Haratamatar420,13,8,https://www.reddit.com/r/dataanalyst/comments/1rv7xyl/where_can_i_practice_interview_sql_questions_and/,2026-03-16 12:23:09,dataanalyst
Looking for Data Analyst Opportunities Any Advice or Referrals Appreciated,SeparateUpstairs2757,2,1,https://www.reddit.com/r/dataanalyst/comments/1rvf3wo/looking_for_data_analyst_opportunities_any_advice/,2026-03-16 16:56:47,dataanalyst
Suggestions Needed from Data professionals,Agreeable_Emu_5013,2,4,https://www.reddit.com/r/dataanalyst/comments/1rvdoc8/suggestions_needed_from_data_professionals/,2026-03-16 16:06:57,dataanalyst
Toxic senior data analyst says I don’t know analysis publicly but assigns me all the work,vxaka,40,7,https://www.reddit.com/r/dataanalyst/comments/1rtlpc1/toxic_senior_data_analyst_says_i_dont_know/,2026-03-14 15:04:25,dataanalyst
"Those with 3-12 months experience in a DA entry-level role, What made you stand out?",No_Mouse_8866,11,2,https://www.reddit.com/r/dataanalyst/comments/1rtsxhm/those_with_312_months_experience_in_a_da/,2026-03-14 19:47:26,dataanalyst
insightfactory.ai Adelaide Work review,RainAlive3089,3,5,https://www.reddit.com/r/dataanalyst/comments/1ru1c0j/insightfactoryai_adelaide_work_review/,2026-03-15 01:41:59,dataanalyst
Valon data analyst Take home assessment,Ok-Distribution1064,1,3,https://www.reddit.com/r/dataanalyst/comments/1ru2hff/valon_data_analyst_take_home_assessment/,2026-03-15 02:36:12,dataanalyst
Does it make sense to use a global describe() when rows belong to different populations?,Vladut31,2,4,https://www.reddit.com/r/dataanalyst/comments/1rttzm2/does_it_make_sense_to_use_a_global_describe_when/,2026-03-14 20:29:06,dataanalyst
Best BI course for Data analytics,PrizeLifeguard8544,12,6,https://www.reddit.com/r/dataanalyst/comments/1rte8cv/best_bi_course_for_data_analytics/,2026-03-14 08:37:59,dataanalyst
Should emphasize DSA or learn ML basics,PartPrize6688,1,1,https://www.reddit.com/r/dataanalyst/comments/1rts4vu/should_emphasize_dsa_or_learn_ml_basics/,2026-03-14 19:15:52,dataanalyst
Software Developer(Java) looking to add Data Analystics to my workflows,pain_point,1,1,https://www.reddit.com/r/dataanalyst/comments/1rtlxx0/software_developerjava_looking_to_add_data/,2026-03-14 15:14:04,dataanalyst
"After 300 applications over 1.5 years, I finally landed a role but I’m nervous about the expect",elreader13,11,6,https://www.reddit.com/r/dataanalyst/comments/1rspazx/after_300_applications_over_15_years_i_finally/,2026-03-13 14:46:24,dataanalyst
Please help me with my GSK interview,[deleted],1,2,https://www.reddit.com/r/dataanalyst/comments/1rsgwm7/please_help_me_with_my_gsk_interview/,2026-03-13 07:36:34,dataanalyst
Remote Opportunity for Data Analyst,AcrobaticSite133,2,5,https://www.reddit.com/r/dataanalyst/comments/1rr6yk3/remote_opportunity_for_data_analyst/,2026-03-11 21:25:15,dataanalyst
pls help me whether this is a scam or no,HotDouble6718,1,3,https://www.reddit.com/r/dataanalyst/comments/1rqmt0z/pls_help_me_whether_this_is_a_scam_or_no/,2026-03-11 07:05:29,dataanalyst
Anyone here in data/analytics with a totally unrelated degree?,Brighter_rocks,45,35,https://www.reddit.com/r/dataanalyst/comments/1rprwjr/anyone_here_in_dataanalytics_with_a_totally/,2026-03-10 09:04:34,dataanalyst
Seeking graduates of The Switch Data Analyst program—is it worth the investment?,Mediocre-Shoulder854,0,1,https://www.reddit.com/r/dataanalyst/comments/1rqle6s/seeking_graduates_of_the_switch_data_analyst/,2026-03-11 05:40:42,dataanalyst
Starting in data analytics on my own,Only_Chip5078,10,10,https://www.reddit.com/r/dataanalyst/comments/1rq20xm/starting_in_data_analytics_on_my_own/,2026-03-10 16:43:08,dataanalyst
applied for analyst opportunites,Ordinary-Fruit6493,1,0,https://www.reddit.com/r/dataanalyst/comments/1rqi162/applied_for_analyst_opportunites/,2026-03-11 02:51:24,dataanalyst
Fully into Data Analyst / Business analyst transition with current skillset.,Wonderful_Error994,0,1,https://www.reddit.com/r/dataanalyst/comments/1rq4atn/fully_into_data_analyst_business_analyst/,2026-03-10 18:02:44,dataanalyst
Stuck as a contract Python/SQL automation engineer in fintech — how do I break into data?,BothEstablishment474,7,2,https://www.reddit.com/r/dataanalyst/comments/1rpmmkf/stuck_as_a_contract_pythonsql_automation_engineer/,2026-03-10 03:54:21,dataanalyst
Embedded Analytics tool for clients and end-users,Feisty-Donut-5546,1,4,https://www.reddit.com/r/dataanalyst/comments/1rps47x/embedded_analytics_tool_for_clients_and_endusers/,2026-03-10 09:17:44,dataanalyst
SQL &amp; Power BI Study Partner – Let’s Grind and Master Data Skills Together,sqroot01,19,50,https://www.reddit.com/r/dataanalyst/comments/1rp4mt3/sql_power_bi_study_partner_lets_grind_and_master/,2026-03-09 16:18:40,dataanalyst
Questions regarding oral interview Data Science ( informatics faculty ),Individual_Abalone27,3,2,https://www.reddit.com/r/dataanalyst/comments/1roz1u8/questions_regarding_oral_interview_data_science/,2026-03-09 12:37:10,dataanalyst
idea for a project for a transaction data or any other,Fun_Consequence_9683,3,2,https://www.reddit.com/r/dataanalyst/comments/1roifxw/idea_for_a_project_for_a_transaction_data_or_any/,2026-03-08 22:24:02,dataanalyst
Looking for career advice on tech,ishy_glowup,1,1,https://www.reddit.com/r/dataanalyst/comments/1rocm8b/looking_for_career_advice_on_tech/,2026-03-08 18:39:12,dataanalyst
Fellow researchers: What are the Best ways to recruit tech workers for qualitative interviews?,Mosaic-Research7083,2,1,https://www.reddit.com/r/dataanalyst/comments/1rnx5vi/fellow_researchers_what_are_the_best_ways_to/,2026-03-08 06:11:54,dataanalyst
what the courses that effect my carrer I should do to study data science and ML,DevilNeverCryy,1,1,https://www.reddit.com/r/dataanalyst/comments/1rnnlgn/what_the_courses_that_effect_my_carrer_i_should/,2026-03-07 22:36:55,dataanalyst
Microsoft Data Scientist (Applied) ic3 interview prep,Patient-Oven-7303,2,0,https://www.reddit.com/r/dataanalyst/comments/1rnge15/microsoft_data_scientist_applied_ic3_interview/,2026-03-07 17:51:47,dataanalyst
Anyone here recently land a Data Analyst role in the US? What worked for you?,Separate-Call-9744,11,3,https://www.reddit.com/r/dataanalyst/comments/1rmigkm/anyone_here_recently_land_a_data_analyst_role_in/,2026-03-06 16:22:09,dataanalyst
Tips to improve analytical thinking,DenseHoney5971,2,2,https://www.reddit.com/r/dataanalyst/comments/1rmqemf/tips_to_improve_analytical_thinking/,2026-03-06 21:15:06,dataanalyst
"I want to be a data analyst in 3 months, is it possible?",1oddhater,29,17,https://www.reddit.com/r/dataanalyst/comments/1rlnug3/i_want_to_be_a_data_analyst_in_3_months_is_it/,2026-03-05 17:33:57,dataanalyst
Best Path to Become a Data Analyst Coming from BPO and Admin Work?,Ok-Platypus-2541,18,8,https://www.reddit.com/r/dataanalyst/comments/1rlf06s/best_path_to_become_a_data_analyst_coming_from/,2026-03-05 11:16:40,dataanalyst
Feeling stuck in a reporting-heavy DA role — how did you transition to DS?,Immediate_Vehicle942,10,9,https://www.reddit.com/r/dataanalyst/comments/1rl9sx2/feeling_stuck_in_a_reportingheavy_da_role_how_did/,2026-03-05 06:04:30,dataanalyst
Senior Data Analysts (DA):Help shape how we assess and train junior talent,Iced__cappuccino,3,2,https://www.reddit.com/r/dataanalyst/comments/1rlezl1/senior_data_analysts_dahelp_shape_how_we_assess/,2026-03-05 11:15:41,dataanalyst
Cluster column chart with isolated agent but keeping team average,Original_Hedgehog_86,2,1,https://www.reddit.com/r/dataanalyst/comments/1rkuyp1/cluster_column_chart_with_isolated_agent_but/,2026-03-04 19:27:46,dataanalyst
Data analysts — what's the one part of your Work that's still stupidly broken in 2026?,CompleteLaw5908,13,11,https://www.reddit.com/r/dataanalyst/comments/1rjvecz/data_analysts_whats_the_one_part_of_your_work/,2026-03-03 17:24:31,dataanalyst
Is Excel a Real Career Skill or Just a Resume Filler in 2026?,CityAccording9333,4,5,https://www.reddit.com/r/dataanalyst/comments/1rk280x/is_excel_a_real_career_skill_or_just_a_resume/,2026-03-03 21:31:47,dataanalyst
Seeking help for data analyst interview preparation for 4.5 years experience,ChannelFit4287,11,7,https://www.reddit.com/r/dataanalyst/comments/1rj7ke9/seeking_help_for_data_analyst_interview/,2026-03-02 22:34:32,dataanalyst
Can I customize a frontend for Metabase queries as a newbie?,Extreme-Meaning4442,1,3,https://www.reddit.com/r/dataanalyst/comments/1rjjg33/can_i_customize_a_frontend_for_metabase_queries/,2026-03-03 07:55:02,dataanalyst
HR round for Optum for Data Analyst tomorrow. What salary can I expect?  Cctc- 9.6 LPA exp- 5 years,StunningBat4775,9,1,https://www.reddit.com/r/dataanalyst/comments/1riy8hy/hr_round_for_optum_for_data_analyst_tomorrow_what/,2026-03-02 16:55:46,dataanalyst
How is the rise of ai tools practically changing how you approach data analysis today?,sad_grapefruit_0,12,7,https://www.reddit.com/r/dataanalyst/comments/1rijhni/how_is_the_rise_of_ai_tools_practically_changing/,2026-03-02 04:44:10,dataanalyst
Have someone transition from QA role to ML / Data analyst?,LilHammer_96,2,2,https://www.reddit.com/r/dataanalyst/comments/1rh52qd/have_someone_transition_from_qa_role_to_ml_data/,2026-02-28 15:13:02,dataanalyst
Inference attacks connecting to DB,Im_Ritter,1,3,https://www.reddit.com/r/dataanalyst/comments/1rh6uea/inference_attacks_connecting_to_db/,2026-02-28 16:24:46,dataanalyst
do anyone know a good resources for data+ v2 exam?,squanric,3,0,https://www.reddit.com/r/dataanalyst/comments/1rgqgut/do_anyone_know_a_good_resources_for_data_v2_exam/,2026-02-28 02:22:25,dataanalyst
Data Analyst → Data Engineer after 1 year experience: realistic?,mayank_002,13,4,https://www.reddit.com/r/dataanalyst/comments/1rg26o9/data_analyst_data_engineer_after_1_year/,2026-02-27 09:31:26,dataanalyst
Senior Data Analyst (10+ yrs) Seeking Global Remote Opportunities – looking for Strategic Advice,Creepy_Paramedic_648,1,1,https://www.reddit.com/r/dataanalyst/comments/1rg7ftj/senior_data_analyst_10_yrs_seeking_global_remote/,2026-02-27 13:59:53,dataanalyst
Tips for preparing STM documentation,Beneficial_Refuse297,1,1,https://www.reddit.com/r/dataanalyst/comments/1rg4osk/tips_for_preparing_stm_documentation/,2026-02-27 11:54:24,dataanalyst
Ab Initio Developer (9 YOE) – Struggling to Get Interviews,Pleasant_Froyo7712,1,1,https://www.reddit.com/r/dataanalyst/comments/1rg3ts4/ab_initio_developer_9_yoe_struggling_to_get/,2026-02-27 11:07:26,dataanalyst
Should I buy Mac for data analytics?,Drexiezz,5,11,https://www.reddit.com/r/dataanalyst/comments/1rfg9h4/should_i_buy_mac_for_data_analytics/,2026-02-26 17:21:36,dataanalyst
Senior Data Scientist Interview Optum,Patient-Oven-7303,6,2,https://www.reddit.com/r/dataanalyst/comments/1rfe5i8/senior_data_scientist_interview_optum/,2026-02-26 16:06:02,dataanalyst
Should I discuss changing my project?,Significant_Fee_6448,1,3,https://www.reddit.com/r/dataanalyst/comments/1rf9h8s/should_i_discuss_changing_my_project/,2026-02-26 12:58:33,dataanalyst
Serious Data Analyst Study Partner Needed,Sad-Information-9323,35,54,https://www.reddit.com/r/dataanalyst/comments/1regr8h/serious_data_analyst_study_partner_needed/,2026-02-25 15:46:03,dataanalyst
how to get on my anaconda download,Bubbly-Cap-5682,2,2,https://www.reddit.com/r/dataanalyst/comments/1rerzjk/how_to_get_on_my_anaconda_download/,2026-02-25 22:24:21,dataanalyst
"trying to make my portifolio better, how can i do this?",Ok_Clothes_4497,2,1,https://www.reddit.com/r/dataanalyst/comments/1reot8c/trying_to_make_my_portifolio_better_how_can_i_do/,2026-02-25 20:26:46,dataanalyst
Do you use chatbots when you require help?,TapZxK,2,3,https://www.reddit.com/r/dataanalyst/comments/1rekrtz/do_you_use_chatbots_when_you_require_help/,2026-02-25 18:05:16,dataanalyst
How start a research on some thing?,Ok_Loquat_8483,2,2,https://www.reddit.com/r/dataanalyst/comments/1reh9d4/how_start_a_research_on_some_thing/,2026-02-25 16:03:47,dataanalyst
🚀 Student Data Analyst / Finance Assistant – Short-Term Project (Remote),Away-Yesterday,7,19,https://www.reddit.com/r/dataanalyst/comments/1re831a/student_data_analyst_finance_assistant_shortterm/,2026-02-25 08:51:47,dataanalyst
"Career Swap Advice, coming from Oil and Gas",bfranny52,2,1,https://www.reddit.com/r/dataanalyst/comments/1rec2th/career_swap_advice_coming_from_oil_and_gas/,2026-02-25 12:38:07,dataanalyst
How would you go about this business question?,edigitalnooomad,3,1,https://www.reddit.com/r/dataanalyst/comments/1rdlc37/how_would_you_go_about_this_business_question/,2026-02-24 16:44:18,dataanalyst
Data analytics free datasets where to find,Hot_Mortgage_4325,3,2,https://www.reddit.com/r/dataanalyst/comments/1rddtjw/data_analytics_free_datasets_where_to_find/,2026-02-24 11:35:00,dataanalyst
Is it hard to change from marketing to data analytics?,Head-Reward-5413,3,3,https://www.reddit.com/r/dataanalyst/comments/1rdafxz/is_it_hard_to_change_from_marketing_to_data/,2026-02-24 08:08:43,dataanalyst
Should I even continue pursuing this career field?,Long_Caregiver2639,10,7,https://www.reddit.com/r/dataanalyst/comments/1rcohsk/should_i_even_continue_pursuing_this_career_field/,2026-02-23 17:53:16,dataanalyst
fresher data analyst role in canada,No-Way641,1,4,https://www.reddit.com/r/dataanalyst/comments/1rcuy7t/fresher_data_analyst_role_in_canada/,2026-02-23 21:43:50,dataanalyst
Should I continue with Data Engineering or switch to GenAI?,iuc_19,19,3,https://www.reddit.com/r/dataanalyst/comments/1ra41xf/should_i_continue_with_data_engineering_or_switch/,2026-02-20 18:55:47,dataanalyst
How do you stay on top of industry changes without constantly checking everything?,Budget_Rutabaga9160,6,2,https://www.reddit.com/r/dataanalyst/comments/1r9rx66/how_do_you_stay_on_top_of_industry_changes/,2026-02-20 10:32:25,dataanalyst
"Final round rejection from analytics role, struggling to reset",KunalDestroyer,1,1,https://www.reddit.com/r/dataanalyst/comments/1ra38vw/final_round_rejection_from_analytics_role/,2026-02-20 18:26:02,dataanalyst
Where to get the datasets for case studies?,quincybee17,2,5,https://www.reddit.com/r/dataanalyst/comments/1r9wcqv/where_to_get_the_datasets_for_case_studies/,2026-02-20 14:10:16,dataanalyst
"Career Advice: AI Business Consultant vs. Data Analyst? (2 Offers, Entry-Level)",Alice_55555,7,8,https://www.reddit.com/r/dataanalyst/comments/1r9l3jm/career_advice_ai_business_consultant_vs_data/,2026-02-20 03:59:21,dataanalyst
What certifications should I take to strengthen my data analytics profile?,buttercup-888,2,0,https://www.reddit.com/r/dataanalyst/comments/1r9lzev/what_certifications_should_i_take_to_strengthen/,2026-02-20 04:43:31,dataanalyst
Greetings from a college students to experts or HR's,HELL__EYE,6,3,https://www.reddit.com/r/dataanalyst/comments/1r905zq/greetings_from_a_college_students_to_experts_or/,2026-02-19 14:09:01,dataanalyst
Grad Certificate in BI/Analytics or Google Data Analytics Professional Certificate?,Powerful-Society9233,7,2,https://www.reddit.com/r/dataanalyst/comments/1r75mgf/grad_certificate_in_bianalytics_or_google_data/,2026-02-17 13:11:41,dataanalyst
Technical Skills vs Analytical Thinking - What Really Matters More in Data?,Dependent_War3001,18,12,https://www.reddit.com/r/dataanalyst/comments/1r6xriv/technical_skills_vs_analytical_thinking_what/,2026-02-17 05:41:35,dataanalyst
How do you deal with mix effects when choosing KPIs?,No_Minimum_6523,3,2,https://www.reddit.com/r/dataanalyst/comments/1r6miu3/how_do_you_deal_with_mix_effects_when_choosing/,2026-02-16 21:27:58,dataanalyst
What really makes sense in dashboards that are meant to drive decisions?,No_Minimum_6523,3,1,https://www.reddit.com/r/dataanalyst/comments/1r6nnik/what_really_makes_sense_in_dashboards_that_are/,2026-02-16 22:11:01,dataanalyst
Data Analytics Assessment for intern Application,Severe_Contract_1025,2,2,https://www.reddit.com/r/dataanalyst/comments/1r6gr9l/data_analytics_assessment_for_intern_application/,2026-02-16 17:58:38,dataanalyst
Data Scientist/Senior Analyst opportunity,Jumpy_Material3197,7,3,https://www.reddit.com/r/dataanalyst/comments/1r5p872/data_scientistsenior_analyst_opportunity/,2026-02-15 20:33:47,dataanalyst
Any Data Science students? Looking for a study buddy! 📊,[deleted],15,26,https://www.reddit.com/r/dataanalyst/comments/1r5f0l8/any_data_science_students_looking_for_a_study/,2026-02-15 13:46:21,dataanalyst
Creating a project and have some doubts,071898,3,3,https://www.reddit.com/r/dataanalyst/comments/1r58jue/creating_a_project_and_have_some_doubts/,2026-02-15 07:31:22,dataanalyst
Data Analyst without dashboarding — is that a problem long term?,Rafiki92IsHere,5,5,https://www.reddit.com/r/dataanalyst/comments/1r50xxb/data_analyst_without_dashboarding_is_that_a/,2026-02-15 00:46:15,dataanalyst
Next step after CS50 Python &amp; SQL? Looking for the best course to learn pandas,HideyoshiSokiYuki,5,2,https://www.reddit.com/r/dataanalyst/comments/1r4eo1g/next_step_after_cs50_python_sql_looking_for_the/,2026-02-14 07:43:32,dataanalyst
LP Analyst excel test and final interview,Fantastic_Chemist540,2,2,https://www.reddit.com/r/dataanalyst/comments/1r4drr3/lp_analyst_excel_test_and_final_interview/,2026-02-14 06:51:18,dataanalyst
Working abroad advice required,Jazzlike_Joke9929,5,3,https://www.reddit.com/r/dataanalyst/comments/1r43ycr/working_abroad_advice_required/,2026-02-13 22:59:35,dataanalyst
How can i convince my manager as an intern to use SQL instead of Access,mariiiiii12,4,14,https://www.reddit.com/r/dataanalyst/comments/1r3ny8c/how_can_i_convince_my_manager_as_an_intern_to_use/,2026-02-13 12:32:05,dataanalyst
What do you use python for in Data Analysis ?,kudrachaa,16,11,https://www.reddit.com/r/dataanalyst/comments/1r2uf5l/what_do_you_use_python_for_in_data_analysis/,2026-02-12 14:10:40,dataanalyst
Looking for high-fidelity clinical datasets for validating a healthcare prototype.,sylenix,2,5,https://www.reddit.com/r/dataanalyst/comments/1r2jnmp/looking_for_highfidelity_clinical_datasets_for/,2026-02-12 04:15:20,dataanalyst
Skills required to get entry level data analyst ready,Fluffy_Piano6950,21,14,https://www.reddit.com/r/dataanalyst/comments/1r1o3cm/skills_required_to_get_entry_level_data_analyst/,2026-02-11 04:52:21,dataanalyst
I built a Power BI dashboard using real WHO cholera outbreak data —what insights would you look for?,Toms_hay,3,1,https://www.reddit.com/r/dataanalyst/comments/1r1ttwz/i_built_a_power_bi_dashboard_using_real_who/,2026-02-11 10:27:05,dataanalyst
Is it possible to get employed without actual certifications and only a portfolio?,Icy-Childhood4306,7,6,https://www.reddit.com/r/dataanalyst/comments/1r1o02i/is_it_possible_to_get_employed_without_actual/,2026-02-11 04:47:40,dataanalyst
Is the ASUS Vivobook 16 OLED (i7-13620H) a reliable workhorse for Power BI &amp; SQL on an $800 budget?,Empty_Upstairs2324,2,3,https://www.reddit.com/r/dataanalyst/comments/1r01wbq/is_the_asus_vivobook_16_oled_i713620h_a_reliable/,2026-02-09 11:34:54,dataanalyst
Tips to prepare for my first technical interview?,itssuushii,3,3,https://www.reddit.com/r/dataanalyst/comments/1qyyb9r/tips_to_prepare_for_my_first_technical_interview/,2026-02-08 03:36:36,dataanalyst
"Starting a Career, but feeling so lost",FlatFacedAsian,16,6,https://www.reddit.com/r/dataanalyst/comments/1qyeo9o/starting_a_career_but_feeling_so_lost/,2026-02-07 14:06:53,dataanalyst
"Looking for Free Certifications (Power BI, SQL, Python) for Data Analyst Resume",jovial_preacher,3,5,https://www.reddit.com/r/dataanalyst/comments/1qycupf/looking_for_free_certifications_power_bi_sql/,2026-02-07 12:43:21,dataanalyst
How competitive is Japan for junior Data / Business Analysts with JLPT N1?,harmeetsingh2321,2,1,https://www.reddit.com/r/dataanalyst/comments/1qy8xs0/how_competitive_is_japan_for_junior_data_business/,2026-02-07 08:53:39,dataanalyst
What do guys think of making a weekly thread for self promotion?,Bobelle,6,4,https://www.reddit.com/r/Nigeria/comments/1rjkjlr/what_do_guys_think_of_making_a_weekly_thread_for/,2026-03-03 09:04:18,Nigeria
Please save yourself the headache and just use the Tax Calculator that the FG provided.,thesonofhermes,43,45,https://i.redd.it/jv76v91417qf1.png,2025-09-19 21:57:44,Nigeria
How it feels walking down the street as a Corper..,Downtown_Inflation17,35,8,https://i.redd.it/obutd7xkuupg1.jpeg,2026-03-18 19:27:23,Nigeria
"Lagos, Nigeria",Amazing_Sprinkles866,87,20,https://i.redd.it/zx1o11u98mpg1.jpeg,2026-03-18 08:16:35,Nigeria
Hausa Woman Producer???,Casimiran,16,5,https://i.redd.it/1t7z5b6pntpg1.jpeg,2026-03-18 15:27:02,Nigeria
My debut novel inspired by my parents' survival of the Nigerian Civil War,Embarrassed-Tank1949,6,0,https://www.reddit.com/gallery/1rxfnhd,2026-03-18 20:40:50,Nigeria
Nigerian Pidgin Words That Came From Latin (Through Portuguese &amp; French),rayxwrite,12,6,https://i.redd.it/v6ffd6rd8upg1.jpeg,2026-03-18 17:23:00,Nigeria
Strait of Mumus,Regular-Lie7449,32,9,https://i.redd.it/86q2kk3vbspg1.jpeg,2026-03-18 10:58:54,Nigeria
Never Forget. 20/10/2020. VOTE RIGHT NEXT YEAR,Opening_External_911,151,37,https://i.redd.it/wedyoilgkppg1.png,2026-03-18 01:42:11,Nigeria
Shell schooled on their crimes in Nigeria,GreenGoodLuck,346,31,https://v.redd.it/tg2pdkjs3opg1,2026-03-17 20:46:47,Nigeria
"Nigerian Military repells ISWAP attack on Malam Fatori, aided by Airforce. (18 March 2026)",Revolutionary_Pick67,6,2,https://v.redd.it/5s00ug9lhupg1,2026-03-18 18:31:57,Nigeria
Old Nollywood is comedy gold ☠️,danlami123,562,76,https://v.redd.it/4idqtaitampg1,2026-03-17 14:43:59,Nigeria
Eid is in a day or two and my tailor didn't get the style.,PumpkinAbject5702,9,7,https://www.reddit.com/r/Nigeria/comments/1rx2ms9/eid_is_in_a_day_or_two_and_my_tailor_didnt_get/,2026-03-18 12:33:30,Nigeria
Marketing,DigitalNomad1789,2,0,https://www.reddit.com/r/Nigeria/comments/1rxdcns/marketing/,2026-03-18 19:18:11,Nigeria
"Dubai based premium millworks/joinery based company, looking to manufacture and sell to the Nigerian Real Estate and Hospitality market",NoCap4583,2,0,https://www.reddit.com/r/Nigeria/comments/1rxc9p8/dubai_based_premium_millworksjoinery_based/,2026-03-18 18:39:43,Nigeria
An honest advice please..,Street-Engineer-9873,4,14,https://www.reddit.com/r/Nigeria/comments/1rx5kv3/an_honest_advice_please/,2026-03-18 14:34:39,Nigeria
My debut novel inspired by my parents' survival of the Nigerian Civil War,Embarrassed-Tank1949,1,0,https://i.redd.it/f4map8vt5vpg1.jpeg,2026-03-18 20:30:26,Nigeria
