title,author,score,num_comments,url,created_utc,subreddit
"[Project] PerpetualBooster v1.9.4 - a GBM that skips the hyperparameter tuning step entirely. Now with drift detection, prediction intervals, and causal inference built in.",mutlu_simsek,61,22,https://www.reddit.com/r/datascience/comments/1rklzpd/project_perpetualbooster_v194_a_gbm_that_skips/,2026-03-04 13:52:54,datascience
Interview process,raharth,35,79,https://www.reddit.com/r/datascience/comments/1rko1ax/interview_process/,2026-03-04 15:14:56,datascience
Will subject matter expertise become more important than technical skills as AI gets more advanced?,Lamp_Shade_Head,133,61,https://www.reddit.com/r/datascience/comments/1rj7ftq/will_subject_matter_expertise_become_more/,2026-03-02 22:29:35,datascience
Does overwork make agents Marxist?,senkichi,38,9,https://freesystems.substack.com/p/does-overwork-make-agents-marxist,2026-03-03 04:09:21,datascience
How are you using AI?,gonna_get_tossed,30,52,https://www.reddit.com/r/datascience/comments/1riw6bu/how_are_you_using_ai/,2026-03-02 15:41:43,datascience
So what do y’all think of the Block layoffs?,Fig_Towel_379,111,83,https://www.reddit.com/r/datascience/comments/1ri0ocx/so_what_do_yall_think_of_the_block_layoffs/,2026-03-01 15:52:38,datascience
"Weekly Entering &amp; Transitioning - Thread 02 Mar, 2026 - 09 Mar, 2026",AutoModerator,2,15,https://www.reddit.com/r/datascience/comments/1rijtqr/weekly_entering_transitioning_thread_02_mar_2026/,2026-03-02 05:01:39,datascience
The top 5 most common product analytics case interview questions asked in big tech interviews,productanalyst9,156,27,https://www.reddit.com/r/datascience/comments/1rhlq92/the_top_5_most_common_product_analytics_case/,2026-03-01 02:44:47,datascience
Time Series Themed Children’s Book,Clicketrie,47,15,https://i.redd.it/7wuuzhr5v8mg1.jpeg,2026-02-28 14:19:04,datascience
Central Limit Theorem in the wild — what happens outside ideal conditions,Grapphie,18,4,https://medium.com/@dominikmiskiewicz/central-limit-theorem-in-the-wild-what-happens-outside-ideal-conditions-4945b2a86d66?postPublishedType=repub,2026-02-27 10:08:15,datascience
My experience after final round interviews at 3 tech companies,productanalyst9,216,43,https://www.reddit.com/r/datascience/comments/1rfiojy/my_experience_after_final_round_interviews_at_3/,2026-02-26 18:48:12,datascience
Should on get a Stats heavy DS degree or Data Science Tech Degree in Today's era,Bulky-Top3782,83,76,https://www.reddit.com/r/datascience/comments/1rffpzo/should_on_get_a_stats_heavy_ds_degree_or_data/,2026-02-26 17:02:30,datascience
"New video tutorial: Going from raw election data to recreating the NYTimes ""Red Shift"" map in 10 minutes with DAAF and Claude Code. With fully reproducible and auditable code pipelines, we're fighting AI slop and hallucinations in data analysis with hyper-transparency!",brhkim,19,2,https://www.reddit.com/r/datascience/comments/1rfc7bt/new_video_tutorial_going_from_raw_election_data/,2026-02-26 14:52:48,datascience
Where should Business Logic live in a Data Solution?,Astherol,20,13,https://leszekmichalak.substack.com/p/where-should-business-logic-live,2026-02-25 21:21:11,datascience
Spark SQL refresher suggestions?,Tamalelulu,35,27,https://www.reddit.com/r/datascience/comments/1rejrgc/spark_sql_refresher_suggestions/,2026-02-25 17:31:10,datascience
"LLMs need ontologies, not semantic models",Thinker_Assignment,0,3,https://i.redd.it/14xkbbg2sslg1.png,2026-02-26 08:18:25,datascience
what changed between my failed interviews and the one that got me an offer,warmeggnog,149,35,https://www.reddit.com/r/datascience/comments/1rdluhe/what_changed_between_my_failed_interviews_and_the/,2026-02-24 17:02:12,datascience
What is your (python) development set up?,br0monium,55,65,https://www.reddit.com/r/datascience/comments/1rdr1k3/what_is_your_python_development_set_up/,2026-02-24 20:05:38,datascience
Corperate Politics for Data Professionals,LeaguePrototype,61,52,https://www.reddit.com/r/datascience/comments/1rdm2ij/corperate_politics_for_data_professionals/,2026-02-24 17:09:52,datascience
What is going on at AirBnB recruiting??,br0monium,20,18,https://www.reddit.com/r/datascience/comments/1rcv1w9/what_is_going_on_at_airbnb_recruiting/,2026-02-23 21:47:40,datascience
Large Language Models for Mortals: A Practical Guide for Analysts,andy_p_w,37,10,https://www.reddit.com/r/datascience/comments/1rcft6y/large_language_models_for_mortals_a_practical/,2026-02-23 12:12:15,datascience
How To Build A Rag System Companies Actually Use,chrisgarzon19,0,1,/r/dataengineeracademy/comments/1rdhdi5/how_to_build_a_rag_system_companies_actually_use/,2026-02-24 14:16:02,datascience
How to not get discouraged while searching for a job?,Fig_Towel_379,83,28,https://www.reddit.com/r/datascience/comments/1rbxt1t/how_to_not_get_discouraged_while_searching_for_a/,2026-02-22 21:12:15,datascience
Requesting feedback once more,Nasibulh,0,22,https://i.redd.it/5ouv7q3lialg1.png,2026-02-23 18:48:22,datascience
"Weekly Entering &amp; Transitioning - Thread 23 Feb, 2026 - 02 Mar, 2026",AutoModerator,3,5,https://www.reddit.com/r/datascience/comments/1rc8edx/weekly_entering_transitioning_thread_23_feb_2026/,2026-02-23 05:01:37,datascience
Data Catalog Tool - Sanity Check,FirCoat,5,2,/r/analytics/comments/1rb8zqj/data_catalog_tool_sanity_check/,2026-02-22 01:46:26,datascience
What should I tell the students about job opportunities?,guna1o0,182,87,https://www.reddit.com/r/datascience/comments/1rahca8/what_should_i_tell_the_students_about_job/,2026-02-21 04:12:53,datascience
Roast my AB test analysis [A],SingerEast1469,15,30,https://www.reddit.com/r/datascience/comments/1raq00v/roast_my_ab_test_analysis_a/,2026-02-21 12:31:50,datascience
Does anyone have good recommendations for learning AI/LLM engineering with Typescript?,Illustrious-Pound266,9,5,https://www.reddit.com/r/datascience/comments/1r9hd8e/does_anyone_have_good_recommendations_for/,2026-02-20 01:06:45,datascience
"AI Was Meant to Free Workers, But Startup Employees Are Working 12-Hour Days",CryoSchema,272,26,https://www.interviewquery.com/p/ai-startup-12-hour-workdays,2026-02-19 04:16:23,datascience
Toronto active data science related job openings numbers - pretty discouraging - how is it in your city?,neuro-psych-amateur,43,18,https://www.reddit.com/r/datascience/comments/1r8o0n4/toronto_active_data_science_related_job_openings/,2026-02-19 03:11:37,datascience
Not quite sure how to think of the paradigm shift to LLM-focused solution,Thin_Original_6765,123,57,https://www.reddit.com/r/datascience/comments/1r8dcx8/not_quite_sure_how_to_think_of_the_paradigm_shift/,2026-02-18 19:52:56,datascience
[Update] How to coach an insular and combative science team,[deleted],6,17,https://www.reddit.com/r/datascience/comments/1r8ray4/update_how_to_coach_an_insular_and_combative/,2026-02-19 05:58:25,datascience
Are you doing DS remote or Hybrid or Full-time office ?,dead_n_alive,7,25,https://www.reddit.com/r/datascience/comments/1r8oc7e/are_you_doing_ds_remote_or_hybrid_or_fulltime/,2026-02-19 03:26:42,datascience
"Loblaws Data Science co-op interview, any advice?",No-Brilliant6770,11,15,https://www.reddit.com/r/datascience/comments/1r8cpbn/loblaws_data_science_coop_interview_any_advice/,2026-02-18 19:28:37,datascience
Career advice for new grads or early career data scientists/analysts looking to ride the AI wave,vanisle_kahuna,68,41,https://www.reddit.com/r/datascience/comments/1r7btpj/career_advice_for_new_grads_or_early_career_data/,2026-02-17 17:02:48,datascience
"Been failing interviews, is it possible my current job is as good as it gets?",quite--average,93,43,https://www.reddit.com/r/datascience/comments/1r6jv0m/been_failing_interviews_is_it_possible_my_current/,2026-02-16 19:49:06,datascience
Current role only does data science 1/4 of the year,Tenet_Bull,71,35,https://www.reddit.com/r/datascience/comments/1r6klm4/current_role_only_does_data_science_14_of_the_year/,2026-02-16 20:16:04,datascience
"Weekly Entering &amp; Transitioning - Thread 16 Feb, 2026 - 23 Feb, 2026",AutoModerator,9,15,https://www.reddit.com/r/datascience/comments/1r60jl0/weekly_entering_transitioning_thread_16_feb_2026/,2026-02-16 05:01:10,datascience
"Today, I’m launching DAAF, the Data Analyst Augmentation Framework: an open-source, extensible workflow for Claude Code that allows skilled researchers to rapidly scale their expertise and accelerate data analysis by 5-10x -- * without * sacrificing scientific transparency, rigor, or reproducibility",brhkim,0,3,https://www.reddit.com/r/datascience/comments/1r6bhke/today_im_launching_daaf_the_data_analyst/,2026-02-16 14:46:00,datascience
Best technique for training models on a sample of data?,RobertWF_47,40,30,https://www.reddit.com/r/datascience/comments/1r53jy3/best_technique_for_training_models_on_a_sample_of/,2026-02-15 02:54:52,datascience
"Outside the US, What is the avg salary someone can get in like Canada, UK, Germany or other countries? For early level",starktonny11,8,32,https://www.reddit.com/r/datascience/comments/1r4wfu9/outside_the_us_what_is_the_avg_salary_someone_can/,2026-02-14 21:27:48,datascience
LLMs for data pipelines without losing control (API → DuckDB in ~10 mins),Thinker_Assignment,0,8,https://www.reddit.com/r/datascience/comments/1r4vmyi/llms_for_data_pipelines_without_losing_control/,2026-02-14 20:54:12,datascience
What differentiates a high impact analytics function from one that just produces dashboards?,Proof_Wrap_2150,62,34,https://www.reddit.com/r/datascience/comments/1r40g4p/what_differentiates_a_high_impact_analytics/,2026-02-13 20:38:23,datascience
Where do you see HR/People Analytics evolving over the next 5 years?,Proof_Wrap_2150,30,18,https://www.reddit.com/r/datascience/comments/1r40rd2/where_do_you_see_hrpeople_analytics_evolving_over/,2026-02-13 20:50:35,datascience
Mock interviews,No-Mud4063,10,12,https://www.reddit.com/r/datascience/comments/1r3zq14/mock_interviews/,2026-02-13 20:10:21,datascience
"What would you do with this task, and how long would it take you to do it?",TheTresStateArea,12,19,https://www.reddit.com/r/datascience/comments/1r3gi4p/what_would_you_do_with_this_task_and_how_long/,2026-02-13 05:14:42,datascience
New Study Finds AI May Be Leading to “Workload Creep” in Tech,warmeggnog,404,44,https://www.interviewquery.com/p/ai-workload-creep-tech-workers-study,2026-02-11 16:05:00,datascience
Meta ds - interview,No-Mud4063,65,26,https://www.reddit.com/r/datascience/comments/1r2flqg/meta_ds_interview/,2026-02-12 01:07:26,datascience
Rescaling logistic regression predictions for under-sampled data?,RobertWF_47,24,22,https://www.reddit.com/r/datascience/comments/1r24okt/rescaling_logistic_regression_predictions_for/,2026-02-11 18:05:18,datascience
[Advice/Vent] How to coach an insular and combative science team,[deleted],74,36,https://www.reddit.com/r/datascience/comments/1r1qo10/advicevent_how_to_coach_an_insular_and_combative/,2026-02-11 07:12:53,datascience
AI isn’t making data science interviews easier.,KitchenTaste7229,210,85,https://www.reddit.com/r/datascience/comments/1r16y9s/ai_isnt_making_data_science_interviews_easier/,2026-02-10 17:23:06,datascience
2026 State of Data Engineering Survey,Bazencourt,7,2,https://joereis.github.io/practical_data_data_eng_survey/,2026-02-10 18:41:56,datascience
An easy process to make sure your executive team understands the data,takenorinvalid,581,35,https://www.reddit.com/r/datascience/comments/1r0dvmw/an_easy_process_to_make_sure_your_executive_team/,2026-02-09 19:28:53,datascience
"[AMA] We’re dbt Labs, ask us anything!",andersdellosnubes,2,1,/r/dataengineering/comments/1r0ff3b/ama_were_dbt_labs_ask_us_anything/,2026-02-10 16:49:40,datascience
You can select points with a lasso now using matplotlib,cantdutchthis,26,0,https://youtu.be/c-nasIVbAoM,2026-02-09 19:04:18,datascience
Memory exhaustion errors (crosspost from snowflake forum),RobertWF_47,1,4,/r/snowflake/comments/1r07w5u/memory_exhaustion_errors/,2026-02-09 17:10:29,datascience
"Weekly Entering &amp; Transitioning - Thread 09 Feb, 2026 - 16 Feb, 2026",AutoModerator,9,6,https://www.reddit.com/r/datascience/comments/1qzv8yw/weekly_entering_transitioning_thread_09_feb_2026/,2026-02-09 05:01:37,datascience
Retraining strategy with evolving classes + imbalanced labels?,fleeced-artichoke,21,8,https://www.reddit.com/r/datascience/comments/1qyhmtx/retraining_strategy_with_evolving_classes/,2026-02-07 16:06:22,datascience
Finding myself disillusioned with the quality of discussion in this sub,galactictock,188,154,https://www.reddit.com/r/datascience/comments/1qxltyk/finding_myself_disillusioned_with_the_quality_of/,2026-02-06 16:11:36,datascience
Is Gen AI the only way forward?,JayBong2k,276,148,https://www.reddit.com/r/datascience/comments/1qxf2xt/is_gen_ai_the_only_way_forward/,2026-02-06 11:25:29,datascience
Fun matplotlib upgrade,cantdutchthis,190,20,https://i.redd.it/hehy4p02v2fg1.gif,2026-02-06 08:46:07,datascience
"This was posted by a guy who ""helps people get hired"", so take it with a grain of salt - ""Which companies hire the most first-time Data Analysts?""",turbo_golf,15,8,https://imgur.com/3v39lf4,2026-02-06 21:57:18,datascience
Data cleaning survival guide,SummerElectrical3642,13,4,https://www.reddit.com/r/datascience/comments/1qxjifc/data_cleaning_survival_guide/,2026-02-06 14:45:51,datascience
easy_sm - A Unix-style CLI for AWS SageMaker that lets you prototype locally before deploying,Far-Media3683,3,3,https://www.reddit.com/r/datascience/comments/1qxo3le/easy_sm_a_unixstyle_cli_for_aws_sagemaker_that/,2026-02-06 17:33:06,datascience
Traditional ML vs Experimentation Data Scientist,PrestigiousCase5089,73,36,https://www.reddit.com/r/datascience/comments/1qx11ri/traditional_ml_vs_experimentation_data_scientist/,2026-02-05 23:18:28,datascience
Has anyone experienced a hands-on Python coding interview focused on data analysis and model training?,Lamp_Shade_Head,61,30,https://www.reddit.com/r/datascience/comments/1qx1cr3/has_anyone_experienced_a_handson_python_coding/,2026-02-05 23:31:09,datascience
"Thinking About Going into Consulting? McKinsey and BCG Interviews Now Test AI Skills, Too",CryoSchema,40,4,https://www.interviewquery.com/p/mckinsey-bcg-ai-consulting-interviews,2026-02-05 05:10:37,datascience
"Production patterns for RAG chatbots: asyncio.gather(), BackgroundTasks, and more",purposefulCA,10,0,/r/Rag/comments/1qw9dxy/production_patterns_for_rag_chatbots/,2026-02-05 02:52:50,datascience
Writing good evals is brutally hard - so I built an AI to make it easier,davernow,0,9,https://www.reddit.com/r/datascience/comments/1qwz1yi/writing_good_evals_is_brutally_hard_so_i_built_an/,2026-02-05 21:59:18,datascience
Why is backward elimination looked down upon yet my team uses it and the model generates millions?,Fig_Towel_379,123,59,https://www.reddit.com/r/datascience/comments/1qv95en/why_is_backward_elimination_looked_down_upon_yet/,2026-02-04 00:17:10,datascience
Destroy my A/B Test Visualization (Part 2) [D],SingerEast1469,0,2,/r/statistics/comments/1qv1a2n/destroy_my_ab_test_visualization_part_2_d/,2026-02-04 03:46:22,datascience
"U.S. Tech Jobs Could See Growth in Q1 2026, Toptal Data Suggests",warmeggnog,156,31,https://www.interviewquery.com/p/us-tech-jobs-growth-q1-2026,2026-02-02 16:35:22,datascience
"[Project] PerpetualBooster v1.1.2: GBM without hyperparameter tuning, now 2x faster with ONNX/XGBoost support",mutlu_simsek,80,18,https://www.reddit.com/r/datascience/comments/1qtr5cw/project_perpetualbooster_v112_gbm_without/,2026-02-02 10:08:33,datascience
"Weekly Entering &amp; Transitioning - Thread 02 Feb, 2026 - 09 Feb, 2026",AutoModerator,7,20,https://www.reddit.com/r/datascience/comments/1qtlvfu/weekly_entering_transitioning_thread_02_feb_2026/,2026-02-02 05:01:38,datascience
Please read the rules before posting!,ymo,338,580,https://www.reddit.com/r/RemoteJobs/comments/1dwbz14/please_read_the_rules_before_posting/,2024-07-05 23:42:49,RemoteJobs
Best Remote Part Time Jobs to Make Extra Money From the Comfort of Your Home?,fixingport,200,28,https://www.reddit.com/r/RemoteJobs/comments/1rwymmx/best_remote_part_time_jobs_to_make_extra_money/,2026-03-18 08:57:49,RemoteJobs
Free Remote Jobs That Opened Today  (18/03/2026) – USA,Ok_Abbreviations9400,12,1,https://www.reddit.com/r/RemoteJobs/comments/1rx7t6r/free_remote_jobs_that_opened_today_18032026_usa/,2026-03-18 15:59:03,RemoteJobs
"Part time flexible remote, is it even worth searching and where do I start?",mysticaltater,7,15,https://www.reddit.com/r/RemoteJobs/comments/1rx9csx/part_time_flexible_remote_is_it_even_worth/,2026-03-18 16:55:37,RemoteJobs
[Hiring] Virtual Project Coordinator - Latin America,lilysenni77,1,0,https://www.reddit.com/r/RemoteJobs/comments/1rxfu4s/hiring_virtual_project_coordinator_latin_america/,2026-03-18 20:47:40,RemoteJobs
Remote Job Offer - Legit?,KiyaValentine,1,8,https://www.reddit.com/r/RemoteJobs/comments/1rx94c3/remote_job_offer_legit/,2026-03-18 16:47:03,RemoteJobs
remote job leads 3/17,SultanXTG,56,3,https://www.reddit.com/r/RemoteJobs/comments/1rwc2li/remote_job_leads_317/,2026-03-17 16:50:59,RemoteJobs
[HIRING] Online Editing (NOT photo / video / audio),Hot-Plastic-8888,0,2,/r/freelance_forhire/comments/1rx3ghc/hiring_online_editing_not_photo_video_audio/,2026-03-18 13:12:52,RemoteJobs
Remote Jobs That Opened Today (17/03/2026) – USA,Ok_Abbreviations9400,28,7,https://www.reddit.com/r/RemoteJobs/comments/1rwfq2v/remote_jobs_that_opened_today_17032026_usa/,2026-03-17 18:55:53,RemoteJobs
Anyone using Pipedrive to manage their contract lead/interview pipeline?,Accomplished-Cap-109,0,0,/r/ContractorUK/comments/1rx2i0z/anyone_using_pipedrive_to_manage_their_contract/,2026-03-18 12:27:57,RemoteJobs
need advice for remote job for a non US resident,chim20air,2,0,https://www.reddit.com/r/RemoteJobs/comments/1rwxklc/need_advice_for_remote_job_for_a_non_us_resident/,2026-03-18 07:50:23,RemoteJobs
[HIRING] Filipino Chat Moderators – Flexible Work + Weekly Payouts,TargetSpecialist6737,1,1,/r/VAjobsPH/comments/1rx0j5r/hiring_filipino_chat_moderators_flexible_work/,2026-03-18 10:50:41,RemoteJobs
"[FOR HIRE] Open to Work | Digital Marketing, Community Growth &amp; Web Development (5+ Years Experience)",Its_Misango,1,0,/r/forhire/comments/1rx0biv/for_hire_open_to_work_digital_marketing_community/,2026-03-18 10:39:40,RemoteJobs
What else would I do a job for?,IndividualDoughnut96,1587,62,https://i.redd.it/tmqgjtqeagpg1.jpeg,2026-03-16 18:39:19,RemoteJobs
[Hiring] Lead Generation Specialists,Quiet-Gain-3726,1,1,https://www.reddit.com/r/RemoteJobs/comments/1rwyh33/hiring_lead_generation_specialists/,2026-03-18 08:48:00,RemoteJobs
Need advice in a tough situation,Hairy-Peanut8832,8,4,https://v.redd.it/q19oearpsnpg1,2026-03-17 19:44:31,RemoteJobs
Affiliate Marketers Wanted. Earn 50% Commission🚨,AdditionalValue9,0,2,https://www.reddit.com/r/RemoteJobs/comments/1rwwo82/affiliate_marketers_wanted_earn_50_commission/,2026-03-18 06:54:07,RemoteJobs
A physical way to keep balance between work and rest. Any other wfh tips?,FFKUSES,15,0,https://i.redd.it/kudrynajempg1.png,2026-03-17 15:03:13,RemoteJobs
[Hiring] Online Tutors – Earn Up to $500/Week! (Remote &amp; Flexible),im_deepanshu69,11,26,https://www.reddit.com/r/RemoteJobs/comments/1rwbbo8/hiring_online_tutors_earn_up_to_500week_remote/,2026-03-17 16:24:42,RemoteJobs
[hiring] 10k+ k@rma redditors,kryc_785,0,5,https://www.reddit.com/r/RemoteJobs/comments/1rx3oy3/hiring_10k_krma_redditors/,2026-03-18 13:19:36,RemoteJobs
I am looking for people to earn recurring income by selling a simple local service (No experience needed),Empty-Experience-641,0,0,https://www.reddit.com/r/RemoteJobs/comments/1rwuilj/i_am_looking_for_people_to_earn_recurring_income/,2026-03-18 04:51:46,RemoteJobs
Appointment setter commission only 4000-6000+ a month,Odd-Veterinarian2962,0,19,https://www.reddit.com/r/RemoteJobs/comments/1rwvqyg/appointment_setter_commission_only_40006000_a/,2026-03-18 05:59:15,RemoteJobs
Do Terminix remote positions offer weekends and holidays off?,AEBRA44,2,4,https://www.reddit.com/r/RemoteJobs/comments/1rwcfkd/do_terminix_remote_positions_offer_weekends_and/,2026-03-17 17:03:27,RemoteJobs
[Paid Study] Seeking Active UX Researchers for a 10-minute AI Interview ($30-$50),PrintMean7254,0,2,https://www.reddit.com/r/RemoteJobs/comments/1rwc93a/paid_study_seeking_active_ux_researchers_for_a/,2026-03-17 16:57:21,RemoteJobs
Earn an easy 5 dollars completing 5 surveys each!,Business_Buy_8276,0,2,https://www.reddit.com/r/RemoteJobs/comments/1rwk7nb/earn_an_easy_5_dollars_completing_5_surveys_each/,2026-03-17 21:34:44,RemoteJobs
Need advice for remote job,No-Sky4145,8,7,https://www.reddit.com/r/RemoteJobs/comments/1rvvjqu/need_advice_for_remote_job/,2026-03-17 03:26:10,RemoteJobs
Remote Jobs Found Today (16/03/2026) – USA,Ok_Abbreviations9400,36,13,https://www.reddit.com/r/RemoteJobs/comments/1rvi4wn/remote_jobs_found_today_16032026_usa/,2026-03-16 18:41:39,RemoteJobs
"Hiring: Appointment Setter / Outbound Ops Assistant (Remote, Full-Time).",quintenkamphuis,5,4,https://www.reddit.com/r/RemoteJobs/comments/1rvx2ph/hiring_appointment_setter_outbound_ops_assistant/,2026-03-17 04:43:16,RemoteJobs
Advice on KYC verification for remote work platforms,No_Presence9577,0,0,https://www.reddit.com/r/RemoteJobs/comments/1rw3jik/advice_on_kyc_verification_for_remote_work/,2026-03-17 11:10:24,RemoteJobs
Green or red flag?,Popular-Tone3037,9,8,https://i.redd.it/tghc5hu4dgpg1.png,2026-03-16 21:31:28,RemoteJobs
"[Hiring] Full-Stack Developer (Remote, Full-Time)",Lam3_mon6,0,4,https://www.reddit.com/r/RemoteJobs/comments/1rw1tuu/hiring_fullstack_developer_remote_fulltime/,2026-03-17 09:33:10,RemoteJobs
🚀 Hiring: AI Engineer (VLM / Autonomous Browser Agents),autionix,0,1,https://www.reddit.com/r/RemoteJobs/comments/1rw0bpp/hiring_ai_engineer_vlm_autonomous_browser_agents/,2026-03-17 07:55:50,RemoteJobs
I have built the tool to improve your google search on remote job,Airpodaway,16,2,https://www.reddit.com/r/RemoteJobs/comments/1rvaix4/i_have_built_the_tool_to_improve_your_google/,2026-03-16 14:11:13,RemoteJobs
Experienced Developer Needed AI Novel Generator Prototype,Cautious_Eye_2923,0,9,https://www.reddit.com/r/RemoteJobs/comments/1rw5plg/experienced_developer_needed_ai_novel_generator/,2026-03-17 12:54:21,RemoteJobs
[hiring] 10k+ k@rma redditors,harry_asitwas,0,2,https://www.reddit.com/r/RemoteJobs/comments/1rvzal7/hiring_10k_krma_redditors/,2026-03-17 06:50:57,RemoteJobs
[Hiring] Remote translators for any of these languages 55~75$/hr,Frostbyte__3,0,2,https://www.reddit.com/r/RemoteJobs/comments/1rvudbp/hiring_remote_translators_for_any_of_these/,2026-03-17 02:30:42,RemoteJobs
I'm building a career platform that replaces the somewhat the CV. Honest feedback wanted.,OkVermicelli3015,2,1,/r/Resume/comments/1rvmzjw/im_building_a_career_platform_that_replaces_the/,2026-03-16 21:33:11,RemoteJobs
Where to Look Remote Job?,Express_Balance_2520,0,4,https://www.reddit.com/r/RemoteJobs/comments/1rvr8na/where_to_look_remote_job/,2026-03-17 00:15:54,RemoteJobs
Need advice and suggestions,pdfplay,2,1,https://www.reddit.com/r/RemoteJobs/comments/1rv9fg3/need_advice_and_suggestions/,2026-03-16 13:27:54,RemoteJobs
Hiring Full Stack Developer (Remote) – ₹50K INR/month – Build a Real Product with a Startup,vermavishal891,0,3,/r/developersIndia/comments/1rvdty3/a_friends_of_mine_needs_help_with_some_full_stack/,2026-03-16 16:19:54,RemoteJobs
Senior Streaming Systems Engineer - Airtame [EU - Remote],varworld,1,1,https://aihackerjobs.com/company/airtame/job/15027,2026-03-16 15:27:39,RemoteJobs
Tech Hiring Surges Amid Market Uncertainty: How to Position Yourself for growth?,ell-chan,0,0,https://www.linkedin.com/posts/simpleapply-ai_tech-hiring-grew-in-february-while-the-rest-activity-7438962217632395264-46VP?utm_source=share&amp;utm_medium=member_desktop&amp;rcm=ACoAADBFsPwBMoaIZXCVQVP6rX8YHhwreUqcy8o,2026-03-16 12:56:53,RemoteJobs
What is the maximum package you get as software developer?,Easy-Association4874,0,0,https://www.reddit.com/r/RemoteJobs/comments/1rv2ofy/what_is_the_maximum_package_you_get_as_software/,2026-03-16 07:14:42,RemoteJobs
Micro1 is hiring Hindi Language Experts,VaracodElmelabes,0,3,https://www.reddit.com/r/RemoteJobs/comments/1ruu0c9/micro1_is_hiring_hindi_language_experts/,2026-03-15 23:56:27,RemoteJobs
Upwork account suspended. Anyone experienced this?,arya_2001,2,1,https://i.redd.it/miipqrfja8pg1.jpeg,2026-03-15 15:36:24,RemoteJobs
[DC] Question,savagehogan,1,2,/r/AskHR/comments/1rto8zb/dc_question/,2026-03-15 18:37:46,RemoteJobs
"I built an AI swarm that spawned 6 computers and applies to jobs simultaneously, here's a live demo you can watch",Independent-Laugh701,0,2,https://v.redd.it/746q9sm7jbpg1,2026-03-16 03:02:39,RemoteJobs
HR / Recruitment remote jobs in EU,Kate_V04,0,1,https://www.reddit.com/r/RemoteJobs/comments/1ruowwu/hr_recruitment_remote_jobs_in_eu/,2026-03-15 20:32:18,RemoteJobs
[PAID] Voice Data Collection / Pair Recording (Native US/CA/AUS English - Worldwide / Remote) - $450,joeurkel,15,154,https://www.reddit.com/r/RemoteJobs/comments/1rttowt/paid_voice_data_collection_pair_recording_native/,2026-03-14 20:17:07,RemoteJobs
"Remote Jobs experience, I would like experience story and earning per month of experienced people ?",Ok_Art8761,0,2,https://www.reddit.com/r/RemoteJobs/comments/1ruczq2/remote_jobs_experience_i_would_like_experience/,2026-03-15 12:38:36,RemoteJobs
Top work from anywhere jobs hiring this week,WordyBug,27,5,https://www.reddit.com/r/RemoteJobs/comments/1rtbfh3/top_work_from_anywhere_jobs_hiring_this_week/,2026-03-14 05:49:44,RemoteJobs
Remote/Global. Paying for a task. $20 per sign up you get,Swimming-Ice2714,0,5,/r/SideJobs/comments/1ru4nqy/remoteglobal_paying_for_a_task_20_per_sign_up_you/,2026-03-15 04:29:18,RemoteJobs
