title,author,score,num_comments,url,created_utc,subreddit
Do ai headshots look fake for linkedin or is it just me being paranoid,Prestigious-Bath8022,0,8,https://www.reddit.com/r/RemoteJobs/comments/1ru7rk7/do_ai_headshots_look_fake_for_linkedin_or_is_it/,2026-03-15 07:26:31,RemoteJobs
Blockchain - Cryptography (asking about summer internship),Savings_Fly6838,4,6,https://www.reddit.com/r/RemoteJobs/comments/1rtg5ng/blockchain_cryptography_asking_about_summer/,2026-03-14 10:38:55,RemoteJobs
Remote Jobs That Opened Today (13/03/2026) – USA,Ok_Abbreviations9400,74,12,https://www.reddit.com/r/RemoteJobs/comments/1rsv4m5/remote_jobs_that_opened_today_13032026_usa/,2026-03-13 18:16:29,RemoteJobs
[FOR HIRE],Glum-Metal-8198,4,1,/r/freelance_forhire/comments/1rrjj4i/for_hire/,2026-03-14 09:26:03,RemoteJobs
What WFH roles or companies are good options right now?,Lhope999,26,15,https://www.reddit.com/r/RemoteJobs/comments/1rt1s39/what_wfh_roles_or_companies_are_good_options/,2026-03-13 22:24:49,RemoteJobs
Is Java still a good career choice today?,Ademozi,1,0,/r/learnprogramming/comments/1rtlij3/is_java_still_a_good_career_choice_today/,2026-03-14 15:01:33,RemoteJobs
Hey everyone want to earn 100$? Don't miss it!,Decent_Clothes2655,0,4,/r/u_Decent_Clothes2655/comments/1rto5ms/hey_everyone_want_to_earn_100_dont_miss_it/,2026-03-14 16:43:55,RemoteJobs
Looking to hire senior DS in India remote,DigitalhomadIndia,1,0,/r/DataScienceJobs/comments/1rtabt0/looking_to_hire_senior_ds_in_india_remote/,2026-03-14 04:49:28,RemoteJobs
Looking for a few people to help with some online casino/sportsbook testing.,ParticularAddition68,0,7,https://www.reddit.com/r/RemoteJobs/comments/1rteu25/looking_for_a_few_people_to_help_with_some_online/,2026-03-14 09:16:30,RemoteJobs
OE in India. How to navigate through EPFO,Salty_Cucumber_3275,2,0,/r/remotework/comments/1rsvcpd/oe_in_india_how_to_navigate_through_epfo/,2026-03-13 18:25:37,RemoteJobs
[HIRING] Freelance Graphic Designer – Remote | $40–$70/hr | Online Education Company,webmasterleo,1,2,https://www.reddit.com/r/RemoteJobs/comments/1rt0vol/hiring_freelance_graphic_designer_remote_4070hr/,2026-03-13 21:49:14,RemoteJobs
Remote workers walk me through the first 30 minutes of your workday,AsesinoYT,0,17,https://www.reddit.com/r/RemoteJobs/comments/1rtbumn/remote_workers_walk_me_through_the_first_30/,2026-03-14 06:14:02,RemoteJobs
We're hiring ONLINE CHAT MODERATORS,dncf121307,2,128,https://www.reddit.com/r/RemoteJobs/comments/1rsodx5/were_hiring_online_chat_moderators/,2026-03-13 14:11:08,RemoteJobs
Do you keep looking for better opportunities?,manav_yantra,8,4,https://www.reddit.com/r/RemoteJobs/comments/1rsf0cv/do_you_keep_looking_for_better_opportunities/,2026-03-13 05:42:42,RemoteJobs
Hiring at NAB gurugram currently NAB gurugram is hiring kindly dm of you have relevant experience.,Zealousideal_Copy985,0,1,https://i.redd.it/1drz56k7vtog1.jpeg,2026-03-13 15:27:35,RemoteJobs
Junior Software Engineer - AI Quality &amp; Testing opening [$30 - $42/hr],Infinite_Mistake_168,3,1,/r/FresherTechJobsIndia/comments/1rshq76/junior_software_engineer_ai_quality_testing/,2026-03-13 08:29:58,RemoteJobs
Remote Jobs That Opened Today  (12/03/2026) – US,Ok_Abbreviations9400,32,7,https://www.reddit.com/r/RemoteJobs/comments/1rs0npv/remote_jobs_that_opened_today_12032026_us/,2026-03-12 19:33:00,RemoteJobs
[Hiring] Local Sales Representative — Heavy Duty Truck Parts (Houston Metro),AccordingDream7292,0,1,https://www.reddit.com/r/RemoteJobs/comments/1rsoerr/hiring_local_sales_representative_heavy_duty/,2026-03-13 14:12:05,RemoteJobs
[HIRING] Operations Associate | Remote (India),UnpaidNPC-,0,7,https://www.reddit.com/r/RemoteJobs/comments/1rso0sn/hiring_operations_associate_remote_india/,2026-03-13 13:56:57,RemoteJobs
This is the only one I got wrong. Practice assessment.,nichelleaw66,0,2,https://i.redd.it/8g1yr4j7tvog1.jpeg,2026-03-13 21:38:38,RemoteJobs
Found a remote recruiter role that looks pretty interesting,webmasterleo,0,0,https://www.reddit.com/r/RemoteJobs/comments/1rsq4s5/found_a_remote_recruiter_role_that_looks_pretty/,2026-03-13 15:17:35,RemoteJobs
"[Hiring] Head of Automation, Remote, $3k/month + bonuses, AI agency (n8n, GHL, WhatsApp, OpenAI)",Competitive-Land-672,0,4,https://www.reddit.com/r/RemoteJobs/comments/1rsn5e8/hiring_head_of_automation_remote_3kmonth_bonuses/,2026-03-13 13:20:29,RemoteJobs
[hiring] 10k+ k@rma redditors,Saiki_kusou01,0,2,https://www.reddit.com/r/RemoteJobs/comments/1rsoicb/hiring_10k_krma_redditors/,2026-03-13 14:15:54,RemoteJobs
Background check,ReflectionFormal9902,4,2,https://www.reddit.com/r/RemoteJobs/comments/1rrxx8k/background_check/,2026-03-12 17:54:56,RemoteJobs
"Lead, Performance and Rewards Program Analyst - Remote ($79,568 - $132,613)",inweed,3,0,https://jobsinweed.com/job-detail/lead-performance-and-rewards-program-analyst-terrascend-8021c2af-a7d9-4a2c-beb5-b9b0b95142a4,2026-03-12 17:31:24,RemoteJobs
Tips for remote workers,No-Swordfish7597,268,36,https://i.redd.it/getrcfdsyfog1.png,2026-03-11 16:21:57,RemoteJobs
The U.S. News Best Jobs List Shows Where Opportunity Is Growing,Excellent_Help_3864,1,0,/r/ModernResumes/comments/1rs4xgo/us_news_100_best_jobs_list_for_2026/,2026-03-12 22:10:54,RemoteJobs
Hiring Trend: Databricks reduced the number of remote US job openings to 21% following Trump’s H1-B updates in Sep 2025,TacoTuesdayX,0,0,/r/InternationalStudents/comments/1rrg90x/hiring_trend_databricks_shifted_strategy_after/,2026-03-12 21:49:50,RemoteJobs
Offering professional resumes (cover letter and headshot available) and interview preparation.,applejaxox,0,2,/r/IndeedJobs/comments/1rs1vfz/offering_professional_resumes_cover_letter_and/,2026-03-12 20:34:09,RemoteJobs
Resume Writing Assistance,Last-Analyst-6345,0,8,https://www.reddit.com/r/RemoteJobs/comments/1rs0qlp/resume_writing_assistance/,2026-03-12 19:35:56,RemoteJobs
Remote Jobs That Opened Today (11/03/2026) – USA,Ok_Abbreviations9400,81,31,https://www.reddit.com/r/RemoteJobs/comments/1rr26v4/remote_jobs_that_opened_today_11032026_usa/,2026-03-11 18:35:57,RemoteJobs
[Hiring] Sales VA (Full-Time),AccordingDream7292,0,2,https://www.reddit.com/r/RemoteJobs/comments/1rrwkui/hiring_sales_va_fulltime/,2026-03-12 17:07:09,RemoteJobs
Tiktok Live while working,Ok_Pomegranate_6860,0,0,https://i.redd.it/fktzuek0pnog1.jpeg,2026-03-12 18:19:36,RemoteJobs
Micro1 is hiring Bengali language experts,VaracodElmelabes,0,1,https://www.reddit.com/r/RemoteJobs/comments/1rriugo/micro1_is_hiring_bengali_language_experts/,2026-03-12 06:04:57,RemoteJobs
Micro1 is hiring Gujarati language experts,VaracodElmelabes,0,0,https://www.reddit.com/r/RemoteJobs/comments/1rrisyg/micro1_is_hiring_gujarati_language_experts/,2026-03-12 06:02:34,RemoteJobs
Micro1 is hiring AutoCAD Experts,VaracodElmelabes,0,0,https://www.reddit.com/r/RemoteJobs/comments/1rripps/micro1_is_hiring_autocad_experts/,2026-03-12 05:57:35,RemoteJobs
Micro1 is hiring WFH Corporate Strategy and Development Associates,VaracodElmelabes,0,0,https://www.reddit.com/r/RemoteJobs/comments/1rriolq/micro1_is_hiring_wfh_corporate_strategy_and/,2026-03-12 05:55:46,RemoteJobs
WFM Specialist looking for the same role of other opportunity,Excilius,1,0,/r/BPOinPH/comments/1rrhcrr/wfm_specialist_looking_for_the_same_role_of_other/,2026-03-12 04:43:00,RemoteJobs
Micro1 is hiring WFH Punjabi Language Experts,VaracodElmelabes,0,4,https://www.reddit.com/r/RemoteJobs/comments/1rriwfb/micro1_is_hiring_wfh_punjabi_language_experts/,2026-03-12 06:08:05,RemoteJobs
Upwork assignments,walking_On-hands,1,1,https://www.reddit.com/r/RemoteJobs/comments/1rrdg7t/upwork_assignments/,2026-03-12 01:39:42,RemoteJobs
"Remote Jobs hiring in Americas, USA, Canada, Ireland &amp; Global",nealkaps,14,0,https://www.reddit.com/r/RemoteJobs/comments/1rqoepo/remote_jobs_hiring_in_americas_usa_canada_ireland/,2026-03-11 08:48:19,RemoteJobs
Advice needed for finding remote job,turbokei,0,3,https://www.reddit.com/r/RemoteJobs/comments/1rr1pbv/advice_needed_for_finding_remote_job/,2026-03-11 18:19:00,RemoteJobs
[Hiring] searching a virtual assistant for social media related task,FinalIybefree,0,3,https://www.reddit.com/r/RemoteJobs/comments/1rrbrkf/hiring_searching_a_virtual_assistant_for_social/,2026-03-12 00:27:58,RemoteJobs
Looking for a remote job,Few-Extension-1813,0,4,https://www.reddit.com/r/RemoteJobs/comments/1rqxhng/looking_for_a_remote_job/,2026-03-11 15:51:12,RemoteJobs
Inviting everyone who works (or has worked before) to answer a short form.,RamenFighter_11,0,0,/r/work/comments/1rqbkye/inviting_everyone_who_works_or_has_worked_before/,2026-03-10 22:28:17,RemoteJobs
[Hiring] Social Media Manager / Video Editor!,C3PBLOW,2,3,https://www.reddit.com/r/RemoteJobs/comments/1rq1hzr/hiring_social_media_manager_video_editor/,2026-03-10 16:24:11,RemoteJobs
Hiring,Over-Veterinarian557,2,4,https://www.reddit.com/r/RemoteJobs/comments/1rpzoxy/hiring/,2026-03-10 15:16:10,RemoteJobs
Micro1 is hiring Urdu Language Experts,VaracodElmelabes,0,3,https://www.reddit.com/r/RemoteJobs/comments/1rq4i6s/micro1_is_hiring_urdu_language_experts/,2026-03-10 18:09:52,RemoteJobs
Monthly Self-Promotion - March 2026,AutoModerator,8,48,https://www.reddit.com/r/webscraping/comments/1rhm1oq/monthly_selfpromotion_march_2026/,2026-03-01 03:00:29,webscraping
"Weekly Webscrapers - Hiring, FAQs, etc",AutoModerator,5,7,https://www.reddit.com/r/webscraping/comments/1rw5v6k/weekly_webscrapers_hiring_faqs_etc/,2026-03-17 13:00:56,webscraping
Show HN: KonbiniAPI – One API for Instagram and TikTok Data,FdezRomero,3,1,https://news.ycombinator.com/item?id=47425940,2026-03-18 15:05:50,webscraping
List your current stack for scalable + complex web scraping/crawling.,codepoetn,10,21,https://www.reddit.com/r/webscraping/comments/1rwefzj/list_your_current_stack_for_scalable_complex_web/,2026-03-17 18:12:01,webscraping
A full-featured MCP server for building async scrapers using Python,yehors,5,0,https://github.com/BitingSnakes/silkworm-mcp,2026-03-17 20:51:37,webscraping
Scraped IMDb Dataset for top 250 movies of all time,Direct-Jicama-4051,3,6,https://www.reddit.com/r/webscraping/comments/1rw67ti/scraped_imdb_dataset_for_top_250_movies_of_all/,2026-03-17 13:15:18,webscraping
Is it possible to use the latest browser version in curl_cffi?,Street-Guarantee2042,7,2,https://www.reddit.com/r/webscraping/comments/1rvct0p/is_it_possible_to_use_the_latest_browser_version/,2026-03-16 15:35:52,webscraping
[Open Source] App that speeds up traffic and saves proxy bandwidth,General-Ride9156,5,2,https://www.reddit.com/r/webscraping/comments/1rv04dv/open_source_app_that_speeds_up_traffic_and_saves/,2026-03-16 04:45:09,webscraping
"Updated AWS WAF Solver, also added full deobfuscator",Jolle_,33,1,https://github.com/jonathanyly/awswaf-solver-api,2026-03-15 17:58:45,webscraping
Best way to scrape Lowes.com?,Commercial-Paper-299,3,18,https://www.reddit.com/r/webscraping/comments/1rur185/best_way_to_scrape_lowescom/,2026-03-15 21:53:50,webscraping
"Akamai 3.0 Sensor_data update, virtual machine decompiled for solvin",alex_pushing40,18,5,https://github.com/drakoarmy/akamai-vm-reverse,2026-03-14 18:12:43,webscraping
Localhost website designs for testing and learning,Its_Sasha,6,0,https://www.reddit.com/r/webscraping/comments/1rtr5mg/localhost_website_designs_for_testing_and_learning/,2026-03-14 18:37:52,webscraping
Need to automate scraping,aswin_4_,0,26,https://www.reddit.com/r/webscraping/comments/1ru6rq7/need_to_automate_scraping/,2026-03-15 06:24:56,webscraping
Experiences of using MCP for content scraping,LDM-88,6,6,https://www.reddit.com/r/webscraping/comments/1rtjng3/experiences_of_using_mcp_for_content_scraping/,2026-03-14 13:37:53,webscraping
Scrape mapbox interactive map,Past_Honeydew_7984,1,6,https://www.reddit.com/r/webscraping/comments/1rtr74l/scrape_mapbox_interactive_map/,2026-03-14 18:39:26,webscraping
Automating weekend flight search– is web scraping feasible or not,stud_j2000,7,11,https://www.reddit.com/r/webscraping/comments/1rt5cur/automating_weekend_flight_search_is_web_scraping/,2026-03-14 00:51:30,webscraping
Need advice on webscraping business registry,XSymbiose,2,11,https://www.reddit.com/r/webscraping/comments/1rsohsy/need_advice_on_webscraping_business_registry/,2026-03-13 14:15:19,webscraping
How to pass all tests of pixelscan?,iamumairayub,5,5,https://www.reddit.com/r/webscraping/comments/1rry0kf/how_to_pass_all_tests_of_pixelscan/,2026-03-12 17:58:14,webscraping
Cloudflare is getting into web crawling,tonypaul009,91,14,https://www.reddit.com/r/webscraping/comments/1rre18s/cloudflare_is_getting_into_web_crawling/,2026-03-12 02:05:27,webscraping
"Headful, headless or headless-shell comparison. Results make sense?",PomegranateHungry719,2,1,https://www.reddit.com/r/webscraping/comments/1rs5zan/headful_headless_or_headlessshell_comparison/,2026-03-12 22:49:37,webscraping
Scraping government sites made me rethink my entire stack,seedtheseed,97,27,https://www.reddit.com/r/webscraping/comments/1rrcr4m/scraping_government_sites_made_me_rethink_my/,2026-03-12 01:09:31,webscraping
"Python + Selenium at scale (50 nodes, 3.9M records)",SuccessfulFact5324,849,160,https://www.reddit.com/gallery/1rqsvgp,2026-03-11 12:50:40,webscraping
Best scraping practices for real estate,astoogler,6,21,https://www.reddit.com/r/webscraping/comments/1rrtmr3/best_scraping_practices_for_real_estate/,2026-03-12 15:20:53,webscraping
How to scrape Ecom site,IntelligentHome2342,4,5,https://www.reddit.com/r/webscraping/comments/1rroj1i/how_to_scrape_ecom_site/,2026-03-12 11:46:13,webscraping
I have an assessment in web scraping and I need help,moms_spaghetti27,4,12,https://www.reddit.com/r/webscraping/comments/1rrgzce/i_have_an_assessment_in_web_scraping_and_i_need/,2026-03-12 04:22:17,webscraping
Giving AI agents a browser with built-in proof of what they scraped,LawLimp202,6,4,https://www.reddit.com/r/webscraping/comments/1rra3xm/giving_ai_agents_a_browser_with_builtin_proof_of/,2026-03-11 23:22:03,webscraping
Does anyone know on how to scrape player data from FotMob? (Python),AFRookie02,3,13,https://www.reddit.com/r/webscraping/comments/1rqw4w9/does_anyone_know_on_how_to_scrape_player_data/,2026-03-11 15:00:12,webscraping
Mobile App API vs. AJAX Endpoint for Data-Only Responses?,hello_world44,7,3,https://www.reddit.com/r/webscraping/comments/1rqply0/mobile_app_api_vs_ajax_endpoint_for_dataonly/,2026-03-11 10:01:54,webscraping
Steam Inventory Scraper Doubt,NervousStrike3338,0,1,https://www.reddit.com/r/webscraping/comments/1rqi652/steam_inventory_scraper_doubt/,2026-03-11 02:57:51,webscraping
Made a tool that scans your browser to research fingerprints.,itwasnteasywasit,149,20,https://v.redd.it/olgufsxma3og1,2026-03-09 21:45:15,webscraping
"Weekly Webscrapers - Hiring, FAQs, etc",AutoModerator,6,5,https://www.reddit.com/r/webscraping/comments/1rpwaby/weekly_webscrapers_hiring_faqs_etc/,2026-03-10 13:00:57,webscraping
"Tinder API: Is Frida RPC the only ""real"" way left to beat JA3?",v4u9,13,8,https://www.reddit.com/r/webscraping/comments/1rpn27d/tinder_api_is_frida_rpc_the_only_real_way_left_to/,2026-03-10 04:15:06,webscraping
Should actually work,PeaseErnest,10,2,https://i.redd.it/l5y3uub854og1.png,2026-03-10 00:38:07,webscraping
Question about ToS,zelscore,1,3,https://www.reddit.com/r/webscraping/comments/1rpgsbc/question_about_tos/,2026-03-09 23:39:49,webscraping
Docprobe – Extract Any Docs Site Into Clean Markdown or PDF,plutonium_Curry,7,2,https://www.reddit.com/r/webscraping/comments/1rp6l1y/docprobe_extract_any_docs_site_into_clean/,2026-03-09 17:27:18,webscraping
Anti-Detect / Traffic Systems Developer / Full Stack Dev | Remote,Fabulous_Ad_3797,0,0,https://www.reddit.com/r/webscraping/comments/1rp9dr7/antidetect_traffic_systems_developer_full_stack/,2026-03-09 19:05:00,webscraping
Trawl: Self healing AI webscraper written in go,KingRonra,56,11,https://www.reddit.com/r/webscraping/comments/1ro6w0j/trawl_self_healing_ai_webscraper_written_in_go/,2026-03-08 14:56:31,webscraping
Beginner need help trying to build a webscraper,Prestigious-Cup-4722,1,18,https://www.reddit.com/r/webscraping/comments/1rovtae/beginner_need_help_trying_to_build_a_webscraper/,2026-03-09 09:44:10,webscraping
Cardmarket Scraping and beginner questions,heyimneph,4,9,https://www.reddit.com/r/webscraping/comments/1roh4nv/cardmarket_scraping_and_beginner_questions/,2026-03-08 21:31:58,webscraping
Need help scraping something,Glittering-Owl-2922,1,6,https://www.reddit.com/r/webscraping/comments/1rol2bx/need_help_scraping_something/,2026-03-09 00:13:48,webscraping
Make solver or bypass datadome,Kitchen_Lie4293,0,4,https://www.reddit.com/r/webscraping/comments/1roiuaj/make_solver_or_bypass_datadome/,2026-03-08 22:40:42,webscraping
How to scrape the following website,Quiet_Dasy,17,21,https://www.reddit.com/r/webscraping/comments/1rn51ne/how_to_scrape_the_following_website/,2026-03-07 08:46:18,webscraping
How to Download All Fics from QuestionableQuesting?,Interesting-Pie7187,2,1,https://www.reddit.com/r/webscraping/comments/1rnfdh4/how_to_download_all_fics_from_questionablequesting/,2026-03-07 17:12:42,webscraping
Retrieving JSON data from site,GOJackson_4953,3,3,https://www.reddit.com/r/webscraping/comments/1rn6iot/retrieving_json_data_from_site/,2026-03-07 10:17:40,webscraping
newbie looking for some advice,Thick-Ride-3868,16,19,https://www.reddit.com/r/webscraping/comments/1rl6zrc/newbie_looking_for_some_advice/,2026-03-05 03:41:52,webscraping
Vercel challange triggered only on postman,crownclown67,1,4,https://www.reddit.com/r/webscraping/comments/1rlcg18/vercel_challange_triggered_only_on_postman/,2026-03-05 08:41:55,webscraping
Site we're scraping from can see we're directly hitting their API,smokedX,2,25,https://www.reddit.com/r/webscraping/comments/1rl4hny/site_were_scraping_from_can_see_were_directly/,2026-03-05 01:47:30,webscraping
Scrapit – a YAML-driven scraping framework.,Mysterious-Usual-920,6,5,https://www.reddit.com/r/webscraping/comments/1rktzet/scrapit_a_yamldriven_scraping_framework/,2026-03-04 18:51:54,webscraping
72M unique registered domains from Common Crawl (2025-Q1 2026),venturepulse,32,15,https://www.reddit.com/r/webscraping/comments/1rjra29/72m_unique_registered_domains_from_common_crawl/,2026-03-03 14:49:54,webscraping
[Hiring] Data Scraper - Build Targeted Contact List,marc_in_bcn,6,0,https://www.reddit.com/r/webscraping/comments/1rk50sv/hiring_data_scraper_build_targeted_contact_list/,2026-03-03 23:21:04,webscraping
Amazon + tls requests + js challenge,happyotaku35,2,9,https://www.reddit.com/r/webscraping/comments/1rk9h63/amazon_tls_requests_js_challenge/,2026-03-04 02:34:15,webscraping
"Weekly Webscrapers - Hiring, FAQs, etc",AutoModerator,4,4,https://www.reddit.com/r/webscraping/comments/1rjopxf/weekly_webscrapers_hiring_faqs_etc/,2026-03-03 13:01:03,webscraping
"Want to scrape, have little idea how.",CheesecakeDouble1415,2,13,https://www.reddit.com/r/webscraping/comments/1rj8dlm/want_to_scrape_have_little_idea_how/,2026-03-02 23:05:43,webscraping
How do you handle session persistence across long scraping jobs?,joo98_98,9,13,https://www.reddit.com/r/webscraping/comments/1rirsm3/how_do_you_handle_session_persistence_across_long/,2026-03-02 12:42:31,webscraping
Interview preparation,nurigrf05,3,0,https://www.reddit.com/r/webscraping/comments/1riqwkw/interview_preparation/,2026-03-02 11:58:05,webscraping
Need help scraping this directory,InternationalFig4933,0,12,https://www.reddit.com/r/webscraping/comments/1rivhmf/need_help_scraping_this_directory/,2026-03-02 15:15:46,webscraping
How to scrape my Gmail contacts with 2 factor authentication enabled,Edblue95,2,5,https://www.reddit.com/r/webscraping/comments/1rige0u/how_to_scrape_my_gmail_contacts_with_2_factor/,2026-03-02 02:13:53,webscraping
Created an open source job scraper for Ashby Hq Jobs.,rishiilahoti,8,1,https://www.reddit.com/r/webscraping/comments/1rheo0m/created_an_open_source_job_scraper_for_ashby_hq/,2026-02-28 21:32:32,webscraping
webscraping websites for arbitrage,misterno123,12,3,https://www.reddit.com/r/webscraping/comments/1rh4kcy/webscraping_websites_for_arbitrage/,2026-02-28 14:51:43,webscraping
[HELP] How to scrape dynamic webistes with pagination,nirvana_49,3,13,https://www.reddit.com/r/webscraping/comments/1rgfbv7/help_how_to_scrape_dynamic_webistes_with/,2026-02-27 18:50:49,webscraping
"Any reported account bans for downloading from Youtube,Twitch, medal?",Quiet_Dasy,2,6,https://www.reddit.com/r/webscraping/comments/1rgfk9b/any_reported_account_bans_for_downloading_from/,2026-02-27 18:59:28,webscraping
Looking for a Simple Scraper for a Simple Need,amikigu,13,33,https://www.reddit.com/r/webscraping/comments/1rfwvga/looking_for_a_simple_scraper_for_a_simple_need/,2026-02-27 04:29:04,webscraping
What's new this year?,3iraven22,2,1,https://www.reddit.com/r/webscraping/comments/1rfw2vo/whats_new_this_year/,2026-02-27 03:49:25,webscraping
Should I focus on bypassing Cloudflare or finding the internal API?,Otherwise-Advance466,7,27,https://www.reddit.com/r/webscraping/comments/1rffmmh/should_i_focus_on_bypassing_cloudflare_or_finding/,2026-02-26 16:59:16,webscraping
Web Scraper / Researcher Needed – Pre-Opening  Business Leads,techguyfl17,7,0,https://www.reddit.com/r/webscraping/comments/1rfdqsb/web_scraper_researcher_needed_preopening_business/,2026-02-26 15:51:03,webscraping
Help with (https://www.swiggy.com/instamart),AltruisticRatio8529,0,15,https://i.redd.it/3syt5x5orylg1.jpeg,2026-02-27 04:21:41,webscraping
I built an open-source no code web scraper Chrome extension,Dry-Raspberry-3608,33,15,https://www.reddit.com/r/webscraping/comments/1rf0nd0/i_built_an_opensource_no_code_web_scraper_chrome/,2026-02-26 04:34:32,webscraping
Costco receipt download automation.,tushar_reddit13,0,2,https://www.reddit.com/r/webscraping/comments/1rfbcoy/costco_receipt_download_automation/,2026-02-26 14:18:32,webscraping
How to scrape ios/android top downloaded apps for a specific country?,letopeto,4,7,https://www.reddit.com/r/webscraping/comments/1reg5wg/how_to_scrape_iosandroid_top_downloaded_apps_for/,2026-02-25 15:24:02,webscraping
How to scrape blackboard,Puzzleheaded-Camp402,1,4,https://www.reddit.com/r/webscraping/comments/1reff1e/how_to_scrape_blackboard/,2026-02-25 14:56:37,webscraping
"Weekly Webscrapers - Hiring, FAQs, etc",AutoModerator,3,9,https://www.reddit.com/r/webscraping/comments/1rdfm7a/weekly_webscrapers_hiring_faqs_etc/,2026-02-24 13:01:04,webscraping
What's working for you with proxy rotation?,Forsaken-Bobcat4065,5,28,https://www.reddit.com/r/webscraping/comments/1rdbvik/whats_working_for_you_with_proxy_rotation/,2026-02-24 09:40:07,webscraping
Scrape transcripts from Spotify,AnglePast1245,8,12,https://www.reddit.com/r/webscraping/comments/1rcxwo5/scrape_transcripts_from_spotify/,2026-02-23 23:36:52,webscraping
I curated a list of 100+ open-source proxy tools,ciokan,34,1,https://www.reddit.com/r/webscraping/comments/1rcb2p8/i_curated_a_list_of_100_opensource_proxy_tools/,2026-02-23 07:31:27,webscraping
Scraping Script Issue,DimensionNeat4498,2,6,https://www.reddit.com/r/webscraping/comments/1rcmpq9/scraping_script_issue/,2026-02-23 16:50:50,webscraping
Anyone else seeing more blocking from cloud IPs lately?,bertdida,7,11,https://www.reddit.com/r/webscraping/comments/1rcad6w/anyone_else_seeing_more_blocking_from_cloud_ips/,2026-02-23 06:49:33,webscraping
Scraping google hotels,LumpyVeterinarian940,2,6,https://www.reddit.com/r/webscraping/comments/1rc8gha/scraping_google_hotels/,2026-02-23 05:04:28,webscraping
How Do I Find the JSON API Endpoint Behind This Operator Search Page?,ed-diee,1,5,https://www.reddit.com/r/webscraping/comments/1rc9zgf/how_do_i_find_the_json_api_endpoint_behind_this/,2026-02-23 06:26:54,webscraping
Question... Scraping Social Media Data,KDavidP1987,2,12,https://www.reddit.com/r/webscraping/comments/1rbrmdv/question_scraping_social_media_data/,2026-02-22 17:22:10,webscraping
How to scrape restaurants data in the US to create my own directory?,kjhasdkfh32,1,35,https://www.reddit.com/r/webscraping/comments/1rbjinn/how_to_scrape_restaurants_data_in_the_us_to/,2026-02-22 11:28:02,webscraping
Anyone succesfull scraping Idealista websites?,aaronn2,5,17,https://www.reddit.com/r/webscraping/comments/1rb50m5/anyone_succesfull_scraping_idealista_websites/,2026-02-21 22:49:54,webscraping
Can you scrape flight data ?,malwaregeeek,3,17,https://www.reddit.com/r/webscraping/comments/1rasgub/can_you_scrape_flight_data/,2026-02-21 14:28:53,webscraping
Target Early Links?,Commercial-Paper-299,2,0,https://www.reddit.com/r/webscraping/comments/1ragnfs/target_early_links/,2026-02-21 03:38:16,webscraping
Avoiding Recaptcha Enterprise v3,saadcarnot,5,22,https://www.reddit.com/r/webscraping/comments/1ra7lkh/avoiding_recaptcha_enterprise_v3/,2026-02-20 21:09:08,webscraping
Newbie Looking For Advice,PaintPractical4321,3,7,https://www.reddit.com/r/webscraping/comments/1ra4xec/newbie_looking_for_advice/,2026-02-20 19:27:33,webscraping
Amazon WAF Solver API,Jolle_,16,3,https://github.com/jonathanyly/awswaf-solver-api,2026-02-20 09:07:13,webscraping
How tò add parameter tò my finished script ?,Quiet_Dasy,1,1,https://www.reddit.com/r/webscraping/comments/1ra3t87/how_tò_add_parameter_tò_my_finished_script/,2026-02-20 18:46:48,webscraping
Brave search does not scrape linkedin posts like google search?,bravelogitex,4,4,https://www.reddit.com/r/webscraping/comments/1r9s0j9/brave_search_does_not_scrape_linkedin_posts_like/,2026-02-20 10:38:01,webscraping
How do I scrape JSON data from a HTTP response in Python?,Quiet_Dasy,0,11,https://i.redd.it/hrn9dsq3dpkg1.jpeg,2026-02-20 19:39:51,webscraping
Need recommendations for web scraping tools,mustazafi,13,18,https://www.reddit.com/r/webscraping/comments/1r93d69/need_recommendations_for_web_scraping_tools/,2026-02-19 16:13:24,webscraping
